page,bbox_x0,bbox_top,bbox_x1,bbox_bottom,NO,KKOODDEE IINNAA--CCBBGG,DDEESSKKRRIIPPSSII KKOODDEE IINNAA--CCBBGG,TTAARRIIFF IINNAA--CCBBGG
564,50.0,109.4,452.8,784.8,1,B-2-10-0,PPRROOSSEEDDUURR PPAADDAA HHAATTII DDAANN PPAANNKKRREEAASS,1.547.100
564,50.0,109.4,452.8,784.8,2,B-2-11-0,PPRROOSSEEDDUURR BBEESSAARR PPAADDAA SSAALLUURRAANN EEMMPPEEDDUU,2.006.800
564,50.0,109.4,452.8,784.8,3,B-2-12-0,PPRROOSSEEDDUURR KKOOLLEESSIISSTTEEKKTTOOMMII TTAANNPPAA LLAAPPAARROOSSKKOOPPII,3.731.900
564,50.0,109.4,452.8,784.8,4,B-2-13-0,PPRROOSSEEDDUURR LLAAIINN--LLAAIINN PPAADDAA HHEEPPAATTOOBBIILLIIAARRII && PPAANNKKRREEAASS,3.855.000
564,50.0,109.4,452.8,784.8,5,B-2-14-0,PPRROOSSEEDDUURR KKOOLLEESSIISSTTEEKKTTOOMMII DDEENNGGAANN LLAAPPAARROOSSKKOOPPII,4.124.300
564,50.0,109.4,452.8,784.8,6,B-3-10-0,PPRROOSSEEDDUURR PPAADDAA PPEERRKKUUTTAANN HHAATTII && SSAALLUURRAANN EEMMPPEEDDUU,1.436.200
564,50.0,109.4,452.8,784.8,7,B-3-11-0,PPRROOSSEEDDUURR EENNDDOOSSKKOOPPII SSAALLUURRAANN EEMMPPEEDDUU,1.867.100
564,50.0,109.4,452.8,784.8,8,B-3-12-0,PPRROOSSEEDDUURR LLAAIINN--LLAAIINN PPAADDAA SSIISSTTEEMM HHEEPPAATTOOBBIILLIIAARRII DDAANN PPAANNKKRREEAASS,576.500
564,50.0,109.4,452.8,784.8,9,C-3-10-0,PPRROOSSEEDDUURR RRAADDIIOOTTEERRAAPPII,1.273.800
564,50.0,109.4,452.8,784.8,10,C-3-11-0,KKEEMMOOTTEERRAAPPII PPAADDAA TTUUMMOORR PPAARRUU && KKAANNDDUUNNGG KKEEMMIIHH,1.153.100
564,50.0,109.4,452.8,784.8,1,C-3-12-0,KKEEMMOOTTEERRAAPPII PPAADDAA TTUUMMOORR KKOOLLOONN,1.255.800
564,50.0,109.4,452.8,784.8,12,C-3-13-0,KKEEMMOOTTEERRAAPPII PPAADDAA TTUUMMOORR PPAAYYUUDDAARRAA AATTAAUU OOVVAARRIIUUMM,1.864.200
564,50.0,109.4,452.8,784.8,13,C-3-14-0,KKEEMMOOTTEERRAAPPII PPAADDAA TTUUMMOORR GGAASSTTRROOIINNTTEESSTTIINNAALL,2.542.700
564,50.0,109.4,452.8,784.8,14,C-3-15-0,"KKEEMMOOTTEERRAAPPII PPAADDAA TTUUMMOORR MMEELLAANNOOMMAA,, GGIINNJJAALL AATTAAUU PPRROOSSTTAATT",2.330.500
564,50.0,109.4,452.8,784.8,15,C-3-16-0,KKEEMMOOTTEERRAAPPII PPAADDAA TTUUMMOORR OOTTAAKK,875.700
564,50.0,109.4,452.8,784.8,16,C-3-17-0,KKEEMMOOTTEERRAAPPII PPAADDAA TTUUMMOORR KKEEPPAALLAA AATTAAUU LLEEHHEERR,1.779.100
564,50.0,109.4,452.8,784.8,17,C-3-18-0,KKEEMMOOTTEERRAAPPII PPAADDAA LLEEUUKKEEMMIIAA AAKKUUTT,814.100
564,50.0,109.4,452.8,784.8,18,C-3-19-0,"KKEEMMOOTTEERRAAPPII PPAADDAA TTUUMMOORR LLIIMMFFOOMMAA,, MMYYEELLOOMMAA AATTAAUU TTEESSTTIISS",1.475.000
564,50.0,109.4,452.8,784.8,19,C-3-20-0,KKEEMMOOTTEERRAAPPII PPAADDAA TTUUMMOORR KKUULLIITT,3.305.500
564,50.0,109.4,452.8,784.8,20,C-3-21-0,KKEEMMOOTTEERRAAPPII PPAADDAA TTUUMMOORR GGIINNEEKKOOLLOOGGII,1.576.600
564,50.0,109.4,452.8,784.8,21,C-3-22-0,KKEEMMOOTTEERRAAPPII PPAADDAA TTUUMMOORR MMEETTAASSTTAASSEE,2.795.600
564,50.0,109.4,452.8,784.8,2,C-3-23-0,KKEEMMOOTTEERRAAPPII PPAADDAA TTUUMMOORR LLAAIINN--LLAAIINN,682.100
564,50.0,109.4,452.8,784.8,23,D-2-10-0,PPRROOSSEEDDUURR PPEENNCCAANNGGKKOOKKAANN SSUUMMSSUUMM TTUULLAANNGG,1.989.000
564,50.0,109.4,452.8,784.8,24,D-2-11-0,PPRROOSSEEDDUURR LLIIMMPPAA,2.847.700
564,50.0,109.4,452.8,784.8,25,D-2-21-0,PPRROOSSEEDDUURR BBEESSAARR PPAADDAA NNOODDUULL LLIIMMPPAA DDAANN TTYYMMUUSS,2.845.400
564,50.0,109.4,452.8,784.8,26,D-2-22-0,PPRROOSSEEDDUURR KKEECCIILL PPAADDAA NNOODDUULL LLIIMMPPAA DDAANN TTYYMMUUSS,699.400
564,50.0,109.4,452.8,784.8,27,D-3-10-0,PPRROOSSEEDDUURR TTRRAANNSSFFUUSSII && TTEERRAAPPII SSUUMMSSUUMM TTUULLAANNGG,1.679.500
564,50.0,109.4,452.8,784.8,28,D-3-11-0,PPRROOSSEEDDUURR DDIIAAGGNNOOSSTTIIKK DDAARRAAHH DDAANN OORRGGAANN PPEEMMBBEENNTTUUKK DDAARRAAHH,1.373.400
564,50.0,109.4,452.8,784.8,29,E-2-10-0,PPRROOSSEEDDUURR PPAADDAA KKEELLEENNJJAARR AADDRREENNAALL,825.300
564,50.0,109.4,452.8,784.8,30,E-2-21-0,PPRROOSSEEDDUURR BBEESSAARR PPAADDAA KKEELLEENNJJAARR TTIIRROOIIDD DDAANN PPAARRAATTIIRROOIIDD,1.032.400
564,50.0,109.4,452.8,784.8,31,E-2-22-0,"PPRROOSSEEDDUURR KKEECCIILL PPAADDAA KKEELLEENNJJAARR TTIIRROOIIDD,,PPAARRAATTIIRROOIIDD DDAANN SSAALLUURRAANN TTHHYYRROOGGLLOOSSSSAALL",804.100
564,50.0,109.4,452.8,784.8,32,E-3-10-0,PPRROOSSEEDDUURR DDIIAAGGNNOOSSTTIIKK PPAADDAA KKEELLEENNJJAARR EENNDDOOKKRRIINN,705.900
564,50.0,109.4,452.8,784.8,3,F-3-10-0,TTEERRAAPPII SSHHOOCCKK,768.900
564,50.0,109.4,452.8,784.8,34,F-5-10-0,PPEELLAAYYAANNAANN KKEESSEEHHAATTAANN MMEENNTTAALL EEKKSSTTEENNSSIIFF,524.800
564,50.0,109.4,452.8,784.8,35,F-5-11-0,TTEERRAAPPII KKEELLOOMMPPOOKK,570.600
564,50.0,109.4,452.8,784.8,36,F-5-12-0,PPRROOSSEEDDUURR TTEESS DDIIAAGGNNOOSSTTIIKK KKEESSEEHHAATTAANN JJIIWWAA,465.300
564,50.0,109.4,452.8,784.8,37,F-5-13-0,PPSSIIKKOOTTEERRAAPPII IINNDDIIVVIIDDUU DDEEWWAASSAA AAKKUUTT,761.000
564,50.0,109.4,452.8,784.8,38,F-5-14-0,PPSSIIKKOOTTHHEERRAAPPII IINNDDIIVVIIDDUU DDEEWWAASSAA BBUUKKAANN AAKKUUTT,394.500
564,50.0,109.4,452.8,784.8,39,F-5-15-0,PPEENNGGOOBBAATTAANN IINNDDIIVVIIDDUU KKEETTEERRBBEELLAAKKAANNGGAANN MMEENNTTAALL,391.500
564,50.0,109.4,452.8,784.8,40,F-5-16-0,PPSSIIKKOOTTHHEERRAAPPII IINNDDIIVVIIDDUU PPAADDAA KKAANNAAKK--KKAANNAAKK MMAASSAALLAAHH KKEESSEEHHAATTAANN MMEENNTTAALL,414.600
564,50.0,109.4,452.8,784.8,41,G-2-10-0,PPRROOSSEEDDUURR KKRRAANNIIOOTTOOMMII,9.108.600
564,50.0,109.4,452.8,784.8,42,G-2-11-0,PPRROOSSEEDDUURR SSHHUUNNTT VVEENNTTRRIIKKEELL,4.387.800
564,50.0,109.4,452.8,784.8,43,G-2-12-0,PPRROOSSEEDDUURR PPAADDAA PPEEMMBBUULLUUHH DDAARRAAHH EEKKSSTTRRAAKKRRAANNIIAALL,3.652.500
564,50.0,109.4,452.8,784.8,4,G-2-13-0,PPRROOSSEEDDUURR CCAARRPPAALL TTUUNNNNEELL RREELLEEAASSEE,1.270.900
564,50.0,109.4,452.8,784.8,45,G-2-21-0,PPRROOSSEEDDUURR BBEESSAARR PPAADDAA SSAARRAAFF PPEERRIIFFEERR,2.873.100
564,50.0,109.4,452.8,784.8,46,G-2-22-0,PPRROOSSEEDDUURR KKEECCIILL PPAADDAA SSAARRAAFF PPEERRIIFFEERR,1.610.900
564,50.0,109.4,452.8,784.8,47,G-2-31-0,PPRROOSSEEDDUURR BBEESSAARR PPAADDAA TTUULLAANNGG BBEELLAAKKAANNGG,2.876.100
564,50.0,109.4,452.8,784.8,48,G-2-32-0,PPRROOSSEEDDUURR KKEECCIILL PPAADDAA TTUULLAANNGG BBEELLAAKKAANNGG,1.954.700
564,50.0,109.4,452.8,784.8,49,G-3-10-0,PPRROOSSEEDDUURR TTAAPP && IINNJJEEKKSSII PPAADDAA SSPPIINNAALL,883.800
564,50.0,109.4,452.8,784.8,50,G-3-11-0,PPRROOSSEEDDUURR IINNJJEEKKSSII PPAADDAA SSAARRAAFF PPEERRIIFFEERR,639.400
564,50.0,109.4,452.8,784.8,51,G-3-12-0,PPRROOSSEEDDUURR PPEEMMEERRIIKKSSAAAANN NNEEUURROOLLOOGGIISS LLAAIINN,875.000
564,50.0,109.4,452.8,784.8,52,G-3-13-0,PPRROOSSEEDDUURR EELLEEKKRROOEENNSSEEFFAALLOOGGRRAAFFII ((EEEEGG)),663.900
564,50.0,109.4,452.8,784.8,53,G-5-17-0,PPEENNYYAAKKIITT SSAARRAAFF KKRRAANNIIAALL DDAANN SSAARRAAFF PPEERRIIFFEERR LLAAIINN--LLAAIINN,413.500
564,50.0,109.4,452.8,784.8,54,H-2-21-0,PPRROOSSEEDDUURR BBEESSAARR PPAADDAA MMAATTAA,4.033.200
564,50.0,109.4,452.8,784.8,5,H-2-22-0,PPRROOSSEEDDUURR SSEEDDAANNGG PPAADDAA MMAATTAA,1.994.100
564,50.0,109.4,452.8,784.8,56,H-2-23-0,PPRROOSSEEDDUURR KKEECCIILL PPAADDAA MMAATTAA,1.075.600
564,50.0,109.4,452.8,784.8,57,H-2-31-0,PPRROOSSEEDDUURR BBEESSAARR PPAADDAA SSEEGGMMEENN AANNTTEERRIIOORR MMAATTAA,4.492.400
564,50.0,109.4,452.8,784.8,58,H-2-32-0,PPRROOSSEEDDUURR SSEEDDAANNGG PPAADDAA SSEEGGMMEENN AANNTTEERRIIOORR MMAATTAA,3.040.500
564,50.0,109.4,452.8,784.8,59,H-2-33-0,PPRROOSSEEDDUURR KKEECCIILL PPAADDAA SSEEGGMMEENN AANNTTEERRIIOORR MMAATTAA,567.500
564,50.0,109.4,452.8,784.8,60,H-2-34-0,PPRROOSSEEDDUURR BBEESSAARR PPAADDAA SSEEGGMMEENN PPOOSSTTEERRIIOORR MMAATTAA,4.548.300
564,50.0,109.4,452.8,784.8,61,H-2-35-0,PPRROOSSEEDDUURR KKEECCIILL PPAADDAA SSEEGGMMEENN PPOOSSTTEERRIIOORR MMAATTAA,3.430.000
564,50.0,109.4,452.8,784.8,62,H-2-36-0,PPRROOSSEEDDUURR OOPPEERRAASSII KKAATTAARRAAKK,4.908.500
564,50.0,109.4,452.8,784.8,63,H-2-37-0,PPRROOSSEEDDUURR PPHHOOTTOOKKOOAAGGUULLAASSII DDAANN KKRRIIOOTTHHEERRAAPPII PPAADDAA RREETTIINNAA,1.849.800
564,50.0,109.4,452.8,784.8,64,H-3-10-0,PPRROOSSEEDDUURR LLAASSEERR SSEEDDAANNGG PPAADDAA MMAATTAA,1.121.000
564,50.0,109.4,452.8,784.8,65,H-3-11-0,PPRROOSSEEDDUURR KKEECCIILL PPAADDAA EEKKTTRRAAOOKKUULLEERR,472.100
564,50.0,109.4,452.8,784.8,6,H-3-12-0,PPRROOSSEEDDUURR LLAAIINN--LLAAIINN PPAADDAA MMAATTAA,428.300
564,50.0,109.4,452.8,784.8,67,H-3-13-0,PPRROOSSEEDDUURR DDIIAAGGNNOOSSTTIIKK && IIMMAAGGIINNGG PPAADDAA MMAATTAA,447.300
564,50.0,109.4,452.8,784.8,68,I-2-11-0,PPEEMMAASSAANNGGAANN//PPEENNYYIISSIIPPAANN DDEEFFIIBBRRIILLAATTOORR JJAANNTTUUNNGG && SSIISSTTEEMM BBAANNTTUU JJAANNTTUUNNGG,6.199.900
564,50.0,109.4,452.8,784.8,69,I-2-12-0,PPRROOSSEEDDUURR BBEESSAARR PPAADDAA PPEEMMBBUULLUUHH DDAARRAAHH TTOORRAASSIIKK,3.478.300
564,50.0,109.4,452.8,784.8,70,I-2-13-0,PPRROOSSEEDDUURR BBEESSAARR PPAADDAA PPEEMMBBUULLUUHH DDAARRAAHH AABBDDOOMMEENN,3.835.600
564,50.0,109.4,452.8,784.8,71,I-2-14-0,PPRROOSSEEDDUURR PPEEMMAASSAANNGGAANN//PPEENNYYIISSIIPPAANN AALLAATT PPAACCUU PPEERRMMAANNEENN PPAADDAA JJAANNTTUUNNGG,7.843.100
564,50.0,109.4,452.8,784.8,72,I-2-15-0,PPRROOSSEEDDUURR KKAATTEETTEERRIISSAASSII JJAANNTTUUNNGG,7.212.000
564,50.0,109.4,452.8,784.8,73,I-2-16-0,PPRROOSSEEDDUURR RREEVVIISSII DDEEFFIIBBRRIILLAATTOORR DDAANN AALLAATT PPAACCUU JJAANNTTUUNNGG TTIIDDAAKK TTEERRMMAASSUUKK PPEENNGGGGAANNTTIIAANN AALLAATT,4.287.500
564,50.0,109.4,452.8,784.8,74,I-2-17-0,PPRROOSSEEDDUURR LLIIGGAASSII DDAANN SSTTRRIIPPPPIINNGG PPEEMMBBUULLUUHH DDAARRAAHH VVEENNAA,1.418.500
564,50.0,109.4,452.8,784.8,75,I-2-21-0,AANNGGIIOOGGRRAAFFII AARRTTEERRII BBUUKKAANN JJAANNTTUUNNGG,4.772.100
564,50.0,109.4,452.8,784.8,76,I-2-22-0,PPRROOSSEEDDUURR SSEEDDAANNGG PPAADDAA PPEEMMBBUULLUUHH DDAARRAAHH,3.116.000
564,50.0,109.4,452.8,784.8,7,I-2-23-0,PPRROOSSEEDDUURR KKEECCIILL PPAADDAA PPEEMMBBUULLUUHH DDAARRAAHH,836.800
564,50.0,109.4,452.8,784.8,78,I-2-31-0,PPEEMMAASSAANNGGAANN AATTAAUU PPEENNGGGGAANNTTIIAANN AALLAATT DDEEFFIIBBRRIILLAATTOORR JJAANNTTUUNNGG,8.278.100
564,50.0,109.4,452.8,784.8,79,I-2-32-0,PPEEMMAASSAANNGGAANN AATTAAUU PPEENNGGGGAANNTTIIAANN AALLAATT PPAACCUU JJAANNTTUUNNGG,7.494.000
565,50.0,102.5,452.8,786.3,80,I-2-41-0,PPRROOSSEEDDUURR EELLEEKKTTRROOFFIISSIIOOLLOOGGIIKK,5.024.700
565,50.0,102.5,452.8,786.3,81,I-2-42-0,PPRROOSSEEDDUURR AANNGGIIOOPPLLAASSTTII PPEEMMBBUULLUUHH DDAARRAAHH KKOORROONNEERR DDAANN KKAARRDDIIOOVVAASSKKUULLAARR PPEERRKKUUTTAANN LLAAIINN,4.790.200
565,50.0,102.5,452.8,786.3,82,I-3-10-0,PPRROOSSEEDDUURR RREESSUUSSIITTAASSII,1.147.100
565,50.0,102.5,452.8,786.3,83,I-3-11-0,PPRROOSSEEDDUURR KKAARRDDIIOOVVEERRSSII,1.040.700
565,50.0,102.5,452.8,786.3,84,I-3-12-0,PPRROOSSEEDDUURR KKEECCIILL LLAAIINN--LLAAIINN PPAADDAA JJAANNTTUUNNGG,1.968.900
565,50.0,102.5,452.8,786.3,85,I-3-13-0,PPRROOSSEEDDUURR EEKKOOKKAARRDDIIOOGGRRAAFFII,574.000
565,50.0,102.5,452.8,786.3,86,I-3-14-0,PPRROOSSEEDDUURR SSTTRREESSSS TTEESSTTIINNGG,528.800
565,50.0,102.5,452.8,786.3,87,I-3-15-0,PPRROOSSEEDDUURR PPEENNGGAAWWAASSAANN FFUUNNGGSSII KKAARRDDIIOOVVAASSKKUULLAARR,529.800
565,50.0,102.5,452.8,786.3,8,J-2-10-0,PPRROOSSEEDDUURR BBEESSAARR PPAADDAA SSIISSTTEEMM SSAALLUURRAANN PPEERRNNAAFFAASSAANN,2.664.500
565,50.0,102.5,452.8,786.3,89,J-2-21-0,PPRROOSSEEDDUURR VVEENNTTIILLAASSII MMEEKKAANNIIKKAALL JJAANNGGKKAA PPEENNDDEEKK,2.757.100
565,50.0,102.5,452.8,786.3,90,J-2-22-0,PPRROOSSEEDDUURR PPAADDAA LLAARRIINNGG DDAANN TTRRAAKKEEAA,2.169.800
565,50.0,102.5,452.8,786.3,91,J-2-31-0,PPRROOSSEEDDUURR TTHHOORRAAKKOOSSKKOOPPII//MMEEDDIIAASSTTIINNOOSSKKOOPPII,2.429.600
565,50.0,102.5,452.8,786.3,92,J-2-32-0,PPRROOSSEEDDUURR DDAADDAA IINNTTEERRMMEEDDIIAATTEE,1.450.600
565,50.0,102.5,452.8,786.3,93,J-3-10-0,PPRROOSSEEDDUURR PPAADDAA DDIINNDDIINNGG DDAADDAA,983.500
565,50.0,102.5,452.8,786.3,94,J-3-11-0,PPRROOSSEEDDUURR PPEEMMAASSAANNGGAANN//PPEENNYYIISSIIPPAANN TTUUBBEE PPAADDAA DDAADDAA,1.280.500
565,50.0,102.5,452.8,786.3,95,J-3-12-0,PPRROOSSEEDDUURR TTHHOORRAACCEENNTTEESSIISS,881.600
565,50.0,102.5,452.8,786.3,96,J-3-13-0,PPRROOSSEEDDUURR TTEERRAAPPII SSAALLUURRAANN PPEERRNNAAFFAASSAANN,526.800
565,50.0,102.5,452.8,786.3,97,J-3-14-0,PPRROOSSEEDDUURR BBIIOOPPSSII PPEERRKKUUTTAANN DDAANN AASSPPIIRRAASSII,848.200
565,50.0,102.5,452.8,786.3,98,J-3-15-0,PPRROOSSEEDDUURR BBRROONNKKOOSSKKOOPPII,652.800
565,50.0,102.5,452.8,786.3,9,J-3-16-0,PPRROOSSEEDDUURR UUJJII FFUUNNGGSSII PPAARRUU,743.200
565,50.0,102.5,452.8,786.3,100,J-3-17-0,PPRROOSSEEDDUURR LLAAIINN--LLAAIINN PPAADDAA SSIISSTTEEMM SSAALLUURRAANN PPEERRNNAAFFAASSAANN,435.700
565,50.0,102.5,452.8,786.3,101,K-2-10-0,PPRROOSSEEDDUURR KKEECCIILL PPAADDAA UUSSUUSS BBEESSAARR DDAANN KKEECCIILL,1.250.400
565,50.0,102.5,452.8,786.3,102,K-2-11-0,PPRROOSSEEDDUURR AADDHHEESSIIOOLLYYSSIISS PPAADDAA PPEERRIITTOONNEEUUMM,2.348.400
565,50.0,102.5,452.8,786.3,103,K-2-12-0,PPRROOSSEEDDUURR PPAADDAA HHEERRNNIIAA TTIIDDAAKK TTEERRMMAASSUUKK HHEERRNNIIAA IINNGGUUIINNAALLIISS DDAANN FFEEMMOORRAALLIISS,1.749.300
565,50.0,102.5,452.8,786.3,104,K-2-13-0,PPRROOSSEEDDUURR PPAADDAA UUSSUUSS BBUUNNTTUU,4.112.400
565,50.0,102.5,452.8,786.3,105,K-2-14-0,PPRROOSSEEDDUURR PPAADDAA HHEERRNNIIAA IINNGGUUIINNAALLIISS DDAANN FFEEMMOORRAALLIISS,895.700
565,50.0,102.5,452.8,786.3,106,K-2-21-0,PPRROOSSEEDDUURR BBEESSAARR PPAADDAA UUSSUUSS HHAALLUUSS DDAANN UUSSUUSS BBEESSAARR,1.038.100
565,50.0,102.5,452.8,786.3,107,K-2-22-0,PPRROOSSEEDDUURR BBEESSAARR PPAADDAA GGAASSTTRROOIINNTTEESSTTIINNAALL AATTAASS,4.750.100
565,50.0,102.5,452.8,786.3,108,K-2-31-0,PPRROOSSEEDDUURR SSEEDDAANNGG PPAADDAA GGAASSTTRROOIINNTTEESSTTIINNAALL AATTAASS,2.209.700
565,50.0,102.5,452.8,786.3,109,K-2-32-0,PPRROOSSEEDDUURR LLAAIINN--LLAAIINN PPAADDAA GGAASSTTRROOIINNTTEESSTTIINNAALL AATTAASS,766.700
565,50.0,102.5,452.8,786.3,110,K-2-41-0,PPRROOSSEEDDUURR LLAAPPAARROOSSKKOOPPII,2.374.000
565,50.0,102.5,452.8,786.3,111,K-2-42-0,PPRROOSSEEDDUURR LLAAPPAARROOTTOOMMII && GGAASSTTRROOIINNTTEESSTTIINNAALL LLAAIINNNNYYAA,5.094.100
565,50.0,102.5,452.8,786.3,112,K-2-51-0,PPRROOSSEEDDUURR UUNNTTUUKK WWAASSIIRR,1.169.600
565,50.0,102.5,452.8,786.3,113,K-2-52-0,PPRROOSSEEDDUURR SSEEDDAANNGG PPAADDAA AANNUUSS && RREEKKTTUUMM,1.287.800
565,50.0,102.5,452.8,786.3,114,K-2-53-0,PPRROOSSEEDDUURR KKEECCIILL PPAADDAA AANNUUSS && RREEKKTTUUMM,494.900
565,50.0,102.5,452.8,786.3,115,K-3-10-0,PPRROOSSEEDDUURR KKEECCIILL LLAAIINN--LLAAIINN PPAADDAA GGAASSTTRROOIINNTTEESSTTIINNAALL,407.300
565,50.0,102.5,452.8,786.3,116,K-3-11-0,PPRROOSSEEDDUURR KKEECCIILL PPAADDAA AANNUUSS && RREEKKTTUUMM,611.100
565,50.0,102.5,452.8,786.3,117,K-3-12-0,PPRROOSSEEDDUURR SSIIGGMMOOIIDDOOSSKKOOPPII DDAANN AANNOOSSKKOOPPII,1.167.700
565,50.0,102.5,452.8,786.3,118,K-3-13-0,PPRROOSSEEDDUURR KKOOLLOONNOOSSKKOOPPII,2.980.800
565,50.0,102.5,452.8,786.3,119,K-3-14-0,PPRROOSSEEDDUURR EENNDDOOSSKKOOPPII BBEESSAARR PPAADDAA GGAASSTTRROOIINNTTEESSTTIINNAALL AATTAASS,2.423.900
565,50.0,102.5,452.8,786.3,120,K-3-15-0,PPRROOSSEEDDUURR EENNDDOOSSKKOOPPII KKEECCIILL PPAADDAA GGAASSTTRROOIINNTTEESSTTIINNAALL AATTAASS,1.868.800
565,50.0,102.5,452.8,786.3,121,K-3-16-0,PPRROOSSEEDDUURR LLAAIINN--LLAAIINN PPAADDAA GGAASSTTRROOIINNTTEESSTTIINNAALL,751.300
565,50.0,102.5,452.8,786.3,122,K-5-18-0,PPEENNYYAAKKIITT SSIISSTTEEMM PPEENNCCEERRNNAAAANN LLAAIINN--LLAAIINN,413.500
565,50.0,102.5,452.8,786.3,123,L-2-21-0,PPRROOSSEEDDUURR BBEESSAARR PPEEMMIINNDDAAHHAANN KKUULLIITT PPAADDAA LLUUKKAA BBAAKKAARR,2.497.300
565,50.0,102.5,452.8,786.3,124,L-2-22-0,PPRROOSSEEDDUURR KKEECCIILL PPEEMMIINNDDAAHHAANN KKUULLIITT PPAADDAA LLUUKKAA BBAAKKAARR,1.600.900
565,50.0,102.5,452.8,786.3,125,L-2-31-0,PPRROOSSEEDDUURR BBEESSAARR PPEEMMIINNDDAAHHAANN KKUULLIITT TTAANNPPAA LLUUKKAA BBAAKKAARR,1.143.000
565,50.0,102.5,452.8,786.3,126,L-2-32-0,PPRROOSSEEDDUURR KKEECCIILL PPEEMMIINNDDAAHHAANN KKUULLIITT TTAANNPPAA LLUUKKAA BBAAKKAARR,939.500
565,50.0,102.5,452.8,786.3,127,L-2-41-0,PPRROOSSEEDDUURR BBEEDDAAHH PPLLAASSTTIIKK,2.238.800
565,50.0,102.5,452.8,786.3,128,L-2-42-0,PPRROOSSEEDDUURR LLAAIINN--LLAAIINN PPAADDAA KKUULLIITT DDAANN JJAARRIINNGGAANN BBAAWWAAHH KKUULLIITT,689.800
565,50.0,102.5,452.8,786.3,129,L-2-51-0,PPRROOSSEEDDUURR PPEENNGGAANNGGKKAATTAANN PPAAYYUUDDAARRAA,2.910.800
565,50.0,102.5,452.8,786.3,130,L-2-52-0,PPRROOSSEEDDUURR BBEESSAARR PPAADDAA PPAAYYUUDDAARRAA TTAANNPPAA PPEENNGGAANNGGKKAATTAANN PPAAYYUUDDAARRAA,2.187.400
565,50.0,102.5,452.8,786.3,131,L-2-53-0,PPRROOSSEEDDUURR KKEECCIILL PPAADDAA PPAAYYUUDDAARRAA TTAANNPPAA PPEENNGGAANNGGKKAATTAANN PPAAYYUUDDAARRAA,1.121.800
565,50.0,102.5,452.8,786.3,132,L-3-10-0,PPRROOSSEEDDUURR KKEECCIILL LLAAIINN--LLAAIINN PPAADDAA PPAAYYUUDDAARRAA,775.100
565,50.0,102.5,452.8,786.3,133,L-3-11-0,PPRROOSSEEDDUURR BBEESSAARR PPAADDAA KKUULLIITT,634.500
565,50.0,102.5,452.8,786.3,134,L-3-12-0,PPRROOSSEEDDUURR KKEECCIILL PPAADDAA KKUULLIITT,492.400
565,50.0,102.5,452.8,786.3,135,M-2-10-0,PPRROOSSEEDDUURR RREEKKOONNTTRRUUKKSSII TTUULLAANNGG KKRRAANNIIAALL DDAANN WWAAJJAAHH,2.383.200
565,50.0,102.5,452.8,786.3,136,M-2-21-0,PPRROOSSEEDDUURR BBEESSAARR PPAADDAA SSEENNDDII PPAANNGGGGUULL DDAANN PPAAHHAA,2.619.500
565,50.0,102.5,452.8,786.3,137,M-2-22-0,PPRROOSSEEDDUURR KKEECCIILL PPAADDAA SSEENNDDII PPAANNGGGGUULL DDAANN PPAAHHAA,558.500
565,50.0,102.5,452.8,786.3,138,M-2-31-0,PPRROOSSEEDDUURR BBUUNNIIOONN,1.591.100
565,50.0,102.5,452.8,786.3,139,M-2-32-0,PPRROOSSEEDDUURR LLAAIINN--LLAAIINN PPAADDAA KKAAKKII,630.200
565,50.0,102.5,452.8,786.3,140,M-2-41-0,"PPRROOSSEEDDUURR EEKKSSIISSII,, IINNSSIISSII DDAANN AARRTTHHRROOTTOOMMII TTUULLAANNGG",888.900
565,50.0,102.5,452.8,786.3,141,M-2-42-0,PPRROOSSEEDDUURR PPEEMMIINNDDAAHHAANN AALLAATT IIMMPPLLAANN,620.300
565,50.0,102.5,452.8,786.3,142,M-2-51-0,PPRROOSSEEDDUURR BBEESSAARR PPAADDAA JJAARRIINNGGAANN LLUUNNAAKK,1.335.500
565,50.0,102.5,452.8,786.3,143,M-2-52-0,PPRROOSSEEDDUURR KKEECCIILL PPAADDAA JJAARRIINNGGAANN LLUUNNAAKK,1.025.000
565,50.0,102.5,452.8,786.3,144,M-2-61-0,PPRROOSSEEDDUURR AARRTTRROOSSKKOOPPII,1.817.300
565,50.0,102.5,452.8,786.3,145,M-2-62-0,PPRROOSSEEDDUURR LLAAIINN--LLAAIINN PPAADDAA SSEENNDDII && TTUULLAANNGG,624.000
565,50.0,102.5,452.8,786.3,146,M-2-63-0,"PPRROOSSEEDDUURR IINNSSIISSII,, BBIIOOPPSSII DDAANN GGRRAAFFTT PPAADDAA TTUULLAANNGG",1.645.800
565,50.0,102.5,452.8,786.3,147,M-2-64-0,PPRROOSSEEDDUURR BBEESSAARR PPAADDAA TTUULLAANNGG KKEEPPAALLAA && WWAAJJAAHH,2.491.800
565,50.0,102.5,452.8,786.3,148,M-2-65-0,PPRROOSSEEDDUURR KKEECCIILL PPAADDAA TTUULLAANNGG KKEEPPAALLAA && WWAAJJAAHH,532.000
565,50.0,102.5,452.8,786.3,149,M-2-71-0,PPRROOSSEEDDUURR BBEESSAARR PPAADDAA LLUUTTUUTT && TTUUNNGGKKAAII BBAAWWAAHH,2.657.200
565,50.0,102.5,452.8,786.3,150,M-2-72-0,PPRROOSSEEDDUURR KKEECCIILL PPAADDAA LLUUTTUUTT && TTUUNNGGKKAAII BBAAWWAAHH,1.440.000
565,50.0,102.5,452.8,786.3,151,M-2-81-0,"PPRROOSSEEDDUURR BBEESSAARR PPAADDAA LLEENNGGAANN,, SSIIKKUU && BBAAHHUU",3.111.700
565,50.0,102.5,452.8,786.3,152,M-2-82-0,"PPRROOSSEEDDUURR KKEECCIILL PPAADDAA LLEENNGGAANN,, SSIIKKUU && BBAAHHUU",1.570.900
565,50.0,102.5,452.8,786.3,153,M-2-83-0,PPRROOSSEEDDUURR BBEESSAARR PPAADDAA TTAANNGGAANN && PPEERRGGEELLAANNGGAANN TTAANNGGAANN,1.196.200
565,50.0,102.5,452.8,786.3,154,M-2-84-0,PPRROOSSEEDDUURR KKEECCIILL PPAADDAA TTAANNGGAANN && PPEERRGGEELLAANNGGAANN TTAANNGGAANN,779.000
565,50.0,102.5,452.8,786.3,155,M-3-10-0,PPRROOSSEEDDUURR MMAANNIIPPUULLAATTIIVVEE OOSSTTEEOOPPAATTHHIICC,184.400
565,50.0,102.5,452.8,786.3,156,M-3-11-0,PPRROOSSEEDDUURR DDIIAAGGNNOOSSTTIIKK DDAANN TTEERRAAPPEEUUTTIIKK MMUUSSKKUULLOOSSKKEELLEETTAALL,691.700
565,50.0,102.5,452.8,786.3,157,M-3-12-0,PPRROOSSEEDDUURR BBIIOOPPSSII SSEENNDDII DDAANN TTRRAAKKSSII SSKKEELLEETTAALL,1.562.800
565,50.0,102.5,452.8,786.3,158,M-3-13-0,PPRROOSSEEDDUURR RREEDDUUKKSSII FFRRAAKKTTUURR TTEERRTTUUTTUUPP,810.300
565,50.0,102.5,452.8,786.3,159,M-3-14-0,PPRROOSSEEDDUURR RREEDDUUKKSSII FFRRAAKKTTUURR WWAAJJAAHH TTEERRTTUUTTUUPP,822.700
566,50.0,102.5,452.8,786.3,160,M-3-15-0,PPRROOSSEEDDUURR AAPPLLIIKKAASSII CCAASSTTSS DDAANN SSPPLLIINNTTSS,540.500
566,50.0,102.5,452.8,786.3,161,M-3-16-0,PPRROOSSEEDDUURR TTHHEERRAAPPII FFIISSIIKK DDAANN PPRROOSSEEDDUURR KKEECCIILL MMUUSSKKUULLOOSSKKLLEETTAALL,223.800
566,50.0,102.5,452.8,786.3,162,M-3-17-0,PPRROOSSEEDDUURR PPEEMMAASSAANNGGAANN AALLAATT PPRROOSSTTEETTIIKK,475.100
566,50.0,102.5,452.8,786.3,163,N-2-11-0,PPRROOSSEEDDUURR BBEESSAARR PPAADDAA KKAANNDDUUNNGG KKEEMMIIHH,7.074.900
566,50.0,102.5,452.8,786.3,164,N-2-12-0,"PPRROOSSEEDDUURR MMEEMMBBUUAATT BBAARRUU,, MMEERREEVVIISSII DDAANN MMEEMMIINNDDAAHHKKAANN AALLAATT DDIIAALLIISSIISS",4.990.000
566,50.0,102.5,452.8,786.3,165,N-2-21-0,EEXXTTRRAACCOORRPPOORREEAALL SSHHOOCCKKWWAAVVEE LLIITTHHOOTTRRIIPPSSYY ((EESSWWLL)) PPAADDAA SSAALLUURRAANN KKEEMMIIHH,6.913.300
566,50.0,102.5,452.8,786.3,166,N-2-22-0,PPRROOSSEEDDUURR BBEESSAARR PPAADDAA GGIINNJJAALL DDAANN UURREETTEERR,2.646.700
566,50.0,102.5,452.8,786.3,167,N-2-23-0,PPRROOSSEEDDUURR SSEEDDAANNGG PPAADDAA GGIINNJJAALL DDAANN UURREETTEERR,1.715.000
566,50.0,102.5,452.8,786.3,168,N-2-24-0,PPRROOSSEEDDUURR KKEECCIILL PPAADDAA GGIINNJJAALL DDAANN UURREETTEERR,1.212.900
566,50.0,102.5,452.8,786.3,169,N-2-31-0,PPRROOSSEEDDUURR BBEESSAARR PPAADDAA KKAANNDDUUNNGG KKEEMMIIHH DDAANN UURREETTHHRRAA,1.519.600
566,50.0,102.5,452.8,786.3,170,N-2-32-0,PPRROOSSEEDDUURR KKEECCIILL PPAADDAA KKAANNDDUUNNGG KKEEMMIIHH DDAANN UURREETTHHRRAA,907.800
566,50.0,102.5,452.8,786.3,171,N-2-41-0,PPRROOSSEEDDUURR BBEESSAARR PPAADDAA UURREETTHHRRAA DDAANN TTRRAANNSSUURREETTHHRRAA,1.795.100
566,50.0,102.5,452.8,786.3,172,N-2-42-0,PPRROOSSEEDDUURR KKEECCIILL PPAADDAA UURREETTHHRRAA DDAANN TTRRAANNSSUURREETTHHRRAA,1.065.900
566,50.0,102.5,452.8,786.3,173,N-3-10-0,PPRROOSSEEDDUURR PPAADDAA GGIINNJJAALL DDAANN UURREETTEERR,584.000
566,50.0,102.5,452.8,786.3,174,N-3-11-0,PPRROOSSEEDDUURR DDIIAAGGNNOOSSTTIIKK LLAAIINN PPAADDAA SSTTUUDDII SSAALLUURRAANN KKEEMMIIHH,871.900
566,50.0,102.5,452.8,786.3,175,N-3-12-0,PPRROOSSEEDDUURR CCYYSSTTOOSSCCOOPPII && PPRROOSSEEDDUURR KKEECCIILL EENNDDOOSSKKOOPPII SSAALLUURRAANN KKEEMMIIHH,1.207.800
566,50.0,102.5,452.8,786.3,176,N-3-13-0,PPRROOSSEEDDUURR BBEESSAARR EENNDDOOSSKKOOPPII PPAADDAA SSAALLUURRAANN KKEEMMIIHH,1.386.200
566,50.0,102.5,452.8,786.3,177,N-3-14-0,PPRROOSSEEDDUURR KKEECCIILL EENNDDOOSSKKOOPPII PPAADDAA SSAALLUURRAANN KKEEMMIIHH,581.900
566,50.0,102.5,452.8,786.3,178,N-3-15-0,PPRROOSSEEDDUURR DDIIAALLIISSIISS,1.104.400
566,50.0,102.5,452.8,786.3,179,O-7-10-0,PPRROOSSEEDDUURR PPEERRSSAALLIINNAANN DDEENNGGAANN BBEEDDAAHH CCAAEESSAARR,2.966.400
566,50.0,102.5,452.8,786.3,180,O-7-11-0,PPEERRSSAALLIINNAANN VVAAGGIINNAALL DDEENNGGAANN SSTTEERRIILLIISSAASSII DDAANN AATTAAUU PPEELLEEBBAARRAANN DDAANN KKUURREETTAASSEE,2.658.200
566,50.0,102.5,452.8,786.3,181,O-7-12-0,PPRROOSSEEDDUURR PPEERRSSAALLIINNAANN VVAAGGIINNAALL DDEENNGGAANN PPRROOSSEEDDUURR SSEELLAAIINN SSTTEERRIILLIISSAASSII DDAANN AATTAAUU PPEELLEEBBAARRAANN DDAANN KKUURREETTAASSEE,2.348.900
566,50.0,102.5,452.8,786.3,182,O-7-13-0,PPRROOSSEEDDUURR PPEERRSSAALLIINNAANN MMEELLAALLUUII VVAAGGIINNAALL//JJAALLAANN LLAAHHIIRR,1.782.300
566,50.0,102.5,452.8,786.3,183,P-9-11-0,"NNEEOONNAATTAALL,, BBBBLL GGRROOUUPP--22",574.200
566,50.0,102.5,452.8,786.3,184,P-9-12-0,"NNEEOONNAATTAALL,, BBBBLL GGRROOUUPP--33",556.400
566,50.0,102.5,452.8,786.3,185,P-9-13-0,"NNEEOONNAATTAALL,, BBBBLL GGRROOUUPP--44",504.500
566,50.0,102.5,452.8,786.3,186,P-9-14-0,"NNEEOONNAATTAALL,, BBBBLL GGRROOUUPP--55 DDEENNGGAANN AANNOOMMAALLII MMAAYYOORR AATTAAUU KKOONNDDIISSII HHEERREEDDIITTEERR",481.200
566,50.0,102.5,452.8,786.3,187,P-9-15-0,"NNEEOONNAATTAALL,, BBBBLL GGRROOUUPP--55 DDEENNGGAANN SSIINNDDRROOMM AASSPPIIRRAASSII",414.500
566,50.0,102.5,452.8,786.3,188,P-9-16-0,"NNEEOONNAATTAALL,, BBBBLL GGRROOUUPP--55 DDEENNGGAANN KKOONNGGEENNIITTAALL//IINNFFEEKKSSII PPEERRIINNAATTAALL",471.100
566,50.0,102.5,452.8,786.3,189,P-9-17-0,"NNEEOONNAATTAALL,, BBBBLL GGRROOUUPP--55",502.400
566,50.0,102.5,452.8,786.3,190,Q-5-10-0,PPEENNYYAALLAAHHGGUUNNAAAANN ZZAATT KKIIMMIIAA AAKKUUTT,543.300
566,50.0,102.5,452.8,786.3,191,Q-5-11-0,PPEENNYYAALLAAHHGGUUNNAAAANN ZZAATT KKIIMMIIAA BBUUKKAANN AAKKUUTT,400.200
566,50.0,102.5,452.8,786.3,192,Q-5-12-0,GIGI,354.400
566,50.0,102.5,452.8,786.3,193,Q-5-13-0,MMEEDDIICCAALL CCHHEECCKK--UUPP,166.300
566,50.0,102.5,452.8,786.3,194,Q-5-14-0,RROONNGGEENNTT ((PPLLAAIINN FFIILLMM)),219.700
566,50.0,102.5,452.8,786.3,195,Q-5-15-0,EELLEEKKTTRROOKKAARRDDIIOOGGRRAAMM ((EECCGG)),111.900
566,50.0,102.5,452.8,786.3,196,Q-5-16-0,VAKSINASI,127.800
566,50.0,102.5,452.8,786.3,197,Q-5-17-0,PPAASSAANNGG IINNFFUUSS,125.300
566,50.0,102.5,452.8,786.3,198,Q-5-18-0,KKOONNSSUULLTTAASSII AATTAAUU PPEEMMEERRIIKKSSAAAANN LLAAIINN--LLAAIINN,410.900
566,50.0,102.5,452.8,786.3,199,Q-5-19-0,KKOONNTTAAKK PPEELLAAYYAANNAANN KKEESSEEHHAATTAANN LLAAIINN--LLAAIINN,217.000
566,50.0,102.5,452.8,786.3,200,Q-5-20-0,AABBOORRSSII MMEENNGGAANNCCAAMM,280.700
566,50.0,102.5,452.8,786.3,201,Q-5-21-0,ABORSI,308.100
566,50.0,102.5,452.8,786.3,202,Q-5-22-0,PPEERRSSAALLIINNAANN YYAANNGG SSUUKKAARR ((FFAALLSSEE LLAABBOORR)),186.100
566,50.0,102.5,452.8,786.3,203,Q-5-23-0,PPEEMMEERRIIKKSSAAAANN AANNTTEEPPAARRTTUUMM,199.000
566,50.0,102.5,452.8,786.3,204,Q-5-24-0,PPEEMMEERRIIKKSSAAAANN PPOOSSTTPPAARRTTUUMM,126.600
566,50.0,102.5,452.8,786.3,205,Q-5-25-0,GGAASSTTRROOIINNTTEESSTTIINNAALL AAKKUUTT,202.800
566,50.0,102.5,452.8,786.3,206,Q-5-26-0,BBRROONNKKIIAALL AAKKUUTT,257.600
566,50.0,102.5,452.8,786.3,207,Q-5-27-0,SSIISSTTEEMM PPEERRSSAARRAAFFAANN PPUUSSAATT AAKKUUTT,193.400
566,50.0,102.5,452.8,786.3,208,Q-5-28-0,KKEECCEEDDEERRAAAANN SSIISSTTEEMM PPEERRSSAARRAAFFAANN PPUUSSAATT,314.900
566,50.0,102.5,452.8,786.3,209,Q-5-29-0,GGAAGGAALL JJAANNTTUUNNGG KKOONNGGEESSTTIIFF DDAANN KKOONNDDIISSII JJAANNTTUUNNGG LLAAIINN--LLAAIINN,890.000
566,50.0,102.5,452.8,786.3,210,Q-5-30-0,IINNFFAARRKK MMIIOOKKAARRDD AAKKUUTT DDAANN AARRIITTMMIIAA,1.031.800
566,50.0,102.5,452.8,786.3,211,Q-5-31-0,FRAKTUR,245.600
566,50.0,102.5,452.8,786.3,212,Q-5-32-0,SSAALLUURRAANN KKEEMMIIHH AAKKUUTT,428.300
566,50.0,102.5,452.8,786.3,213,Q-5-33-0,HHEEMMAATTOOLLOOGGII AAKKUUTT,242.900
566,50.0,102.5,452.8,786.3,214,Q-5-34-0,IINNFFEEKKSSII VVIIRRUUSS HHIIVV,292.900
566,50.0,102.5,452.8,786.3,215,Q-5-35-0,IINNFFEEKKSSII AAKKUUTT,720.500
