page,bbox_x0,bbox_top,bbox_x1,bbox_bottom,NO,KKOODDEE IINNAA--CCBBGG,DDEESSKKRRIIPPSSII KKOODDEE IINNAA--CCBBGG,TTAARRIIFF IINNAA--CCBBGG
410,50.0,109.4,452.8,784.8,1,B-2-10-0,PPRROOSSEEDDUURR PPAADDAA HHAATTII DDAANN PPAANNKKRREEAASS,1.045.000
410,50.0,109.4,452.8,784.8,2,B-2-11-0,PPRROOSSEEDDUURR BBEESSAARR PPAADDAA SSAALLUURRAANN EEMMPPEEDDUU,1.154.000
410,50.0,109.4,452.8,784.8,3,B-2-12-0,PPRROOSSEEDDUURR KKOOLLEESSIISSTTEEKKTTOOMMII TTAANNPPAA LLAAPPAARROOSSKKOOPPII,2.415.500
410,50.0,109.4,452.8,784.8,4,B-2-13-0,PPRROOSSEEDDUURR LLAAIINN--LLAAIINN PPAADDAA HHEEPPAATTOOBBIILLIIAARRII && PPAANNKKRREEAASS,2.450.400
410,50.0,109.4,452.8,784.8,5,B-2-14-0,PPRROOSSEEDDUURR KKOOLLEESSIISSTTEEKKTTOOMMII DDEENNGGAANN LLAAPPAARROOSSKKOOPPII,2.945.000
410,50.0,109.4,452.8,784.8,6,B-3-10-0,PPRROOSSEEDDUURR PPAADDAA PPEERRKKUUTTAANN HHAATTII && SSAALLUURRAANN EEMMPPEEDDUU,1.079.500
410,50.0,109.4,452.8,784.8,7,B-3-11-0,PPRROOSSEEDDUURR EENNDDOOSSKKOOPPII SSAALLUURRAANN EEMMPPEEDDUU,923.900
410,50.0,109.4,452.8,784.8,8,B-3-12-0,PPRROOSSEEDDUURR LLAAIINN--LLAAIINN PPAADDAA SSIISSTTEEMM HHEEPPAATTOOBBIILLIIAARRII DDAANN PPAANNKKRREEAASS,398.600
410,50.0,109.4,452.8,784.8,9,C-3-10-0,PPRROOSSEEDDUURR RRAADDIIOOTTEERRAAPPII,-
410,50.0,109.4,452.8,784.8,10,C-3-11-0,KKEEMMOOTTEERRAAPPII PPAADDAA TTUUMMOORR PPAARRUU && KKAANNDDUUNNGG KKEEMMIIHH,899.300
410,50.0,109.4,452.8,784.8,1,C-3-12-0,KKEEMMOOTTEERRAAPPII PPAADDAA TTUUMMOORR KKOOLLOONN,958.100
410,50.0,109.4,452.8,784.8,12,C-3-13-0,KKEEMMOOTTEERRAAPPII PPAADDAA TTUUMMOORR PPAAYYUUDDAARRAA AATTAAUU OOVVAARRIIUUMM,1.326.000
410,50.0,109.4,452.8,784.8,13,C-3-14-0,KKEEMMOOTTEERRAAPPII PPAADDAA TTUUMMOORR GGAASSTTRROOIINNTTEESSTTIINNAALL,1.758.300
410,50.0,109.4,452.8,784.8,14,C-3-15-0,"KKEEMMOOTTEERRAAPPII PPAADDAA TTUUMMOORR MMEELLAANNOOMMAA,, GGIINNJJAALL AATTAAUU PPRROOSSTTAATT",1.313.500
410,50.0,109.4,452.8,784.8,15,C-3-16-0,KKEEMMOOTTEERRAAPPII PPAADDAA TTUUMMOORR OOTTAAKK,684.500
410,50.0,109.4,452.8,784.8,16,C-3-17-0,KKEEMMOOTTEERRAAPPII PPAADDAA TTUUMMOORR KKEEPPAALLAA AATTAAUU LLEEHHEERR,1.308.300
410,50.0,109.4,452.8,784.8,17,C-3-18-0,KKEEMMOOTTEERRAAPPII PPAADDAA LLEEUUKKEEMMIIAA AAKKUUTT,637.300
410,50.0,109.4,452.8,784.8,18,C-3-19-0,"KKEEMMOOTTEERRAAPPII PPAADDAA TTUUMMOORR LLIIMMFFOOMMAA,, MMYYEELLOOMMAA AATTAAUU TTEESSTTIISS",999.000
410,50.0,109.4,452.8,784.8,19,C-3-20-0,KKEEMMOOTTEERRAAPPII PPAADDAA TTUUMMOORR KKUULLIITT,1.863.000
410,50.0,109.4,452.8,784.8,20,C-3-21-0,KKEEMMOOTTEERRAAPPII PPAADDAA TTUUMMOORR GGIINNEEKKOOLLOOGGII,1.224.200
410,50.0,109.4,452.8,784.8,21,C-3-22-0,KKEEMMOOTTEERRAAPPII PPAADDAA TTUUMMOORR MMEETTAASSTTAASSEE,1.575.600
410,50.0,109.4,452.8,784.8,2,C-3-23-0,KKEEMMOOTTEERRAAPPII PPAADDAA TTUUMMOORR LLAAIINN--LLAAIINN,384.500
410,50.0,109.4,452.8,784.8,23,D-2-10-0,PPRROOSSEEDDUURR PPEENNCCAANNGGKKOOKKAANN SSUUMMSSUUMM TTUULLAANNGG,896.800
410,50.0,109.4,452.8,784.8,24,D-2-11-0,PPRROOSSEEDDUURR LLIIMMPPAA,2.033.400
410,50.0,109.4,452.8,784.8,25,D-2-21-0,PPRROOSSEEDDUURR BBEESSAARR PPAADDAA NNOODDUULL LLIIMMPPAA DDAANN TTYYMMUUSS,2.031.800
410,50.0,109.4,452.8,784.8,26,D-2-22-0,PPRROOSSEEDDUURR KKEECCIILL PPAADDAA NNOODDUULL LLIIMMPPAA DDAANN TTYYMMUUSS,499.400
410,50.0,109.4,452.8,784.8,27,D-3-10-0,PPRROOSSEEDDUURR TTRRAANNSSFFUUSSII && TTEERRAAPPII SSUUMMSSUUMM TTUULLAANNGG,1.066.000
410,50.0,109.4,452.8,784.8,28,D-3-11-0,PPRROOSSEEDDUURR DDIIAAGGNNOOSSTTIIKK DDAARRAAHH DDAANN OORRGGAANN PPEEMMBBEENNTTUUKK DDAARRAAHH,1.022.000
410,50.0,109.4,452.8,784.8,29,E-2-10-0,PPRROOSSEEDDUURR PPAADDAA KKEELLEENNJJAARR AADDRREENNAALL,589.300
410,50.0,109.4,452.8,784.8,30,E-2-21-0,PPRROOSSEEDDUURR BBEESSAARR PPAADDAA KKEELLEENNJJAARR TTIIRROOIIDD DDAANN PPAARRAATTIIRROOIIDD,776.000
410,50.0,109.4,452.8,784.8,31,E-2-22-0,"PPRROOSSEEDDUURR KKEECCIILL PPAADDAA KKEELLEENNJJAARR TTIIRROOIIDD,,PPAARRAATTIIRROOIIDD DDAANN SSAALLUURRAANN TTHHYYRROOGGLLOOSSSSAALL",604.400
410,50.0,109.4,452.8,784.8,32,E-3-10-0,PPRROOSSEEDDUURR DDIIAAGGNNOOSSTTIIKK PPAADDAA KKEELLEENNJJAARR EENNDDOOKKRRIINN,504.000
410,50.0,109.4,452.8,784.8,3,F-3-10-0,TTEERRAAPPII SSHHOOCCKK,431.700
410,50.0,109.4,452.8,784.8,34,F-5-10-0,PPEELLAAYYAANNAANN KKEESSEEHHAATTAANN MMEENNTTAALL EEKKSSTTEENNSSIIFF,374.700
410,50.0,109.4,452.8,784.8,35,F-5-11-0,TTEERRAAPPII KKEELLOOMMPPOOKK,346.000
410,50.0,109.4,452.8,784.8,36,F-5-12-0,PPRROOSSEEDDUURR TTEESS DDIIAAGGNNOOSSTTIIKK KKEESSEEHHAATTAANN JJIIWWAA,332.300
410,50.0,109.4,452.8,784.8,37,F-5-13-0,PPSSIIKKOOTTEERRAAPPII IINNDDIIVVIIDDUU DDEEWWAASSAA AAKKUUTT,445.600
410,50.0,109.4,452.8,784.8,38,F-5-14-0,PPSSIIKKOOTTHHEERRAAPPII IINNDDIIVVIIDDUU DDEEWWAASSAA BBUUKKAANN AAKKUUTT,247.100
410,50.0,109.4,452.8,784.8,39,F-5-15-0,PPEENNGGOOBBAATTAANN IINNDDIIVVIIDDUU KKEETTEERRBBEELLAAKKAANNGGAANN MMEENNTTAALL,246.900
410,50.0,109.4,452.8,784.8,40,F-5-16-0,PPSSIIKKOOTTHHEERRAAPPII IINNDDIIVVIIDDUU PPAADDAA KKAANNAAKK--KKAANNAAKK MMAASSAALLAAHH KKEESSEEHHAATTAANN MMEENNTTAALL,296.000
410,50.0,109.4,452.8,784.8,41,G-2-10-0,PPRROOSSEEDDUURR KKRRAANNIIOOTTOOMMII,5.133.500
410,50.0,109.4,452.8,784.8,42,G-2-11-0,PPRROOSSEEDDUURR SSHHUUNNTT VVEENNTTRRIIKKEELL,3.133.100
410,50.0,109.4,452.8,784.8,43,G-2-12-0,PPRROOSSEEDDUURR PPAADDAA PPEEMMBBUULLUUHH DDAARRAAHH EEKKSSTTRRAAKKRRAANNIIAALL,2.058.500
410,50.0,109.4,452.8,784.8,4,G-2-13-0,PPRROOSSEEDDUURR CCAARRPPAALL TTUUNNNNEELL RREELLEEAASSEE,907.500
410,50.0,109.4,452.8,784.8,45,G-2-21-0,PPRROOSSEEDDUURR BBEESSAARR PPAADDAA SSAARRAAFF PPEERRIIFFEERR,2.051.500
410,50.0,109.4,452.8,784.8,46,G-2-22-0,PPRROOSSEEDDUURR KKEECCIILL PPAADDAA SSAARRAAFF PPEERRIIFFEERR,1.150.200
410,50.0,109.4,452.8,784.8,47,G-2-31-0,PPRROOSSEEDDUURR BBEESSAARR PPAADDAA TTUULLAANNGG BBEELLAAKKAANNGG,2.053.700
410,50.0,109.4,452.8,784.8,48,G-2-32-0,PPRROOSSEEDDUURR KKEECCIILL PPAADDAA TTUULLAANNGG BBEELLAAKKAANNGG,1.469.200
410,50.0,109.4,452.8,784.8,49,G-3-10-0,PPRROOSSEEDDUURR TTAAPP && IINNJJEEKKSSII PPAADDAA SSPPIINNAALL,631.100
410,50.0,109.4,452.8,784.8,50,G-3-11-0,PPRROOSSEEDDUURR IINNJJEEKKSSII PPAADDAA SSAARRAAFF PPEERRIIFFEERR,456.600
410,50.0,109.4,452.8,784.8,51,G-3-12-0,PPRROOSSEEDDUURR PPEEMMEERRIIKKSSAAAANN NNEEUURROOLLOOGGIISS LLAAIINN,541.300
410,50.0,109.4,452.8,784.8,52,G-3-13-0,PPRROOSSEEDDUURR EELLEEKKRROOEENNSSEEFFAALLOOGGRRAAFFII ((EEEEGG)),474.100
410,50.0,109.4,452.8,784.8,53,G-5-17-0,PPEENNYYAAKKIITT SSAARRAAFF KKRRAANNIIAALL DDAANN SSAARRAAFF PPEERRIIFFEERR LLAAIINN--LLAAIINN,233.100
410,50.0,109.4,452.8,784.8,54,H-2-21-0,PPRROOSSEEDDUURR BBEESSAARR PPAADDAA MMAATTAA,2.709.300
410,50.0,109.4,452.8,784.8,5,H-2-22-0,PPRROOSSEEDDUURR SSEEDDAANNGG PPAADDAA MMAATTAA,1.423.900
410,50.0,109.4,452.8,784.8,56,H-2-23-0,PPRROOSSEEDDUURR KKEECCIILL PPAADDAA MMAATTAA,604.700
410,50.0,109.4,452.8,784.8,57,H-2-31-0,PPRROOSSEEDDUURR BBEESSAARR PPAADDAA SSEEGGMMEENN AANNTTEERRIIOORR MMAATTAA,2.819.700
410,50.0,109.4,452.8,784.8,58,H-2-32-0,PPRROOSSEEDDUURR SSEEDDAANNGG PPAADDAA SSEEGGMMEENN AANNTTEERRIIOORR MMAATTAA,2.171.100
410,50.0,109.4,452.8,784.8,59,H-2-33-0,PPRROOSSEEDDUURR KKEECCIILL PPAADDAA SSEEGGMMEENN AANNTTEERRIIOORR MMAATTAA,405.200
410,50.0,109.4,452.8,784.8,60,H-2-34-0,PPRROOSSEEDDUURR BBEESSAARR PPAADDAA SSEEGGMMEENN PPOOSSTTEERRIIOORR MMAATTAA,3.050.500
410,50.0,109.4,452.8,784.8,61,H-2-35-0,PPRROOSSEEDDUURR KKEECCIILL PPAADDAA SSEEGGMMEENN PPOOSSTTEERRIIOORR MMAATTAA,2.449.200
410,50.0,109.4,452.8,784.8,62,H-2-36-0,PPRROOSSEEDDUURR OOPPEERRAASSII KKAATTAARRAAKK,3.193.400
410,50.0,109.4,452.8,784.8,63,H-2-37-0,PPRROOSSEEDDUURR PPHHOOTTOOKKOOAAGGUULLAASSII DDAANN KKRRIIOOTTHHEERRAAPPII PPAADDAA RREETTIINNAA,1.320.800
410,50.0,109.4,452.8,784.8,64,H-3-10-0,PPRROOSSEEDDUURR LLAASSEERR SSEEDDAANNGG PPAADDAA MMAATTAA,800.500
410,50.0,109.4,452.8,784.8,65,H-3-11-0,PPRROOSSEEDDUURR KKEECCIILL PPAADDAA EEKKTTRRAAOOKKUULLEERR,337.100
410,50.0,109.4,452.8,784.8,6,H-3-12-0,PPRROOSSEEDDUURR LLAAIINN--LLAAIINN PPAADDAA MMAATTAA,225.500
410,50.0,109.4,452.8,784.8,67,H-3-13-0,PPRROOSSEEDDUURR DDIIAAGGNNOOSSTTIIKK && IIMMAAGGIINNGG PPAADDAA MMAATTAA,277.700
410,50.0,109.4,452.8,784.8,68,I-2-11-0,PPEEMMAASSAANNGGAANN//PPEENNYYIISSIIPPAANN DDEEFFIIBBRRIILLAATTOORR JJAANNTTUUNNGG && SSIISSTTEEMM BBAANNTTUU JJAANNTTUUNNGG,3.752.600
410,50.0,109.4,452.8,784.8,69,I-2-12-0,PPRROOSSEEDDUURR BBEESSAARR PPAADDAA PPEEMMBBUULLUUHH DDAARRAAHH TTOORRAASSIIKK,1.721.200
410,50.0,109.4,452.8,784.8,70,I-2-13-0,PPRROOSSEEDDUURR BBEESSAARR PPAADDAA PPEEMMBBUULLUUHH DDAARRAAHH AABBDDOOMMEENN,2.161.700
410,50.0,109.4,452.8,784.8,71,I-2-14-0,PPRROOSSEEDDUURR PPEEMMAASSAANNGGAANN//PPEENNYYIISSIIPPAANN AALLAATT PPAACCUU PPEERRMMAANNEENN PPAADDAA JJAANNTTUUNNGG,5.600.400
410,50.0,109.4,452.8,784.8,72,I-2-15-0,PPRROOSSEEDDUURR KKAATTEETTEERRIISSAASSII JJAANNTTUUNNGG,-
410,50.0,109.4,452.8,784.8,73,I-2-16-0,PPRROOSSEEDDUURR RREEVVIISSII DDEEFFIIBBRRIILLAATTOORR DDAANN AALLAATT PPAACCUU JJAANNTTUUNNGG TTIIDDAAKK TTEERRMMAASSUUKK PPEENNGGGGAANNTTIIAANN AALLAATT,2.974.400
410,50.0,109.4,452.8,784.8,74,I-2-17-0,PPRROOSSEEDDUURR LLIIGGAASSII DDAANN SSTTRRIIPPPPIINNGG PPEEMMBBUULLUUHH DDAARRAAHH VVEENNAA,920.800
410,50.0,109.4,452.8,784.8,75,I-2-21-0,AANNGGIIOOGGRRAAFFII AARRTTEERRII BBUUKKAANN JJAANNTTUUNNGG,2.689.500
410,50.0,109.4,452.8,784.8,76,I-2-22-0,PPRROOSSEEDDUURR SSEEDDAANNGG PPAADDAA PPEEMMBBUULLUUHH DDAARRAAHH,1.962.900
410,50.0,109.4,452.8,784.8,7,I-2-23-0,PPRROOSSEEDDUURR KKEECCIILL PPAADDAA PPEEMMBBUULLUUHH DDAARRAAHH,597.500
410,50.0,109.4,452.8,784.8,78,I-2-31-0,PPEEMMAASSAANNGGAANN AATTAAUU PPEENNGGGGAANNTTIIAANN AALLAATT DDEEFFIIBBRRIILLAATTOORR JJAANNTTUUNNGG,5.910.900
410,50.0,109.4,452.8,784.8,79,I-2-32-0,PPEEMMAASSAANNGGAANN AATTAAUU PPEENNGGGGAANNTTIIAANN AALLAATT PPAACCUU JJAANNTTUUNNGG,5.351.000
411,50.0,102.5,452.8,786.3,80,I-2-41-0,PPRROOSSEEDDUURR EELLEEKKTTRROOFFIISSIIOOLLOOGGIIKK,3.587.900
411,50.0,102.5,452.8,786.3,81,I-2-42-0,PPRROOSSEEDDUURR AANNGGIIOOPPLLAASSTTII PPEEMMBBUULLUUHH DDAARRAAHH KKOORROONNEERR DDAANN KKAARRDDIIOOVVAASSKKUULLAARR PPEERRKKUUTTAANN LLAAIINN,3.420.500
411,50.0,102.5,452.8,786.3,82,I-3-10-0,PPRROOSSEEDDUURR RREESSUUSSIITTAASSII,862.200
411,50.0,102.5,452.8,786.3,83,I-3-11-0,PPRROOSSEEDDUURR KKAARRDDIIOOVVEERRSSII,782.200
411,50.0,102.5,452.8,786.3,84,I-3-12-0,PPRROOSSEEDDUURR KKEECCIILL LLAAIINN--LLAAIINN PPAADDAA JJAANNTTUUNNGG,1.109.600
411,50.0,102.5,452.8,786.3,85,I-3-13-0,PPRROOSSEEDDUURR EEKKOOKKAARRDDIIOOGGRRAAFFII,409.900
411,50.0,102.5,452.8,786.3,86,I-3-14-0,PPRROOSSEEDDUURR SSTTRREESSSS TTEESSTTIINNGG,377.600
411,50.0,102.5,452.8,786.3,87,I-3-15-0,PPRROOSSEEDDUURR PPEENNGGAAWWAASSAANN FFUUNNGGSSII KKAARRDDIIOOVVAASSKKUULLAARR,298.700
411,50.0,102.5,452.8,786.3,8,J-2-10-0,PPRROOSSEEDDUURR BBEESSAARR PPAADDAA SSIISSTTEEMM SSAALLUURRAANN PPEERRNNAAFFAASSAANN,1.902.600
411,50.0,102.5,452.8,786.3,89,J-2-21-0,PPRROOSSEEDDUURR VVEENNTTIILLAASSII MMEEKKAANNIIKKAALL JJAANNGGKKAA PPEENNDDEEKK,1.968.700
411,50.0,102.5,452.8,786.3,90,J-2-22-0,PPRROOSSEEDDUURR PPAADDAA LLAARRIINNGG DDAANN TTRRAAKKEEAA,1.222.900
411,50.0,102.5,452.8,786.3,91,J-2-31-0,PPRROOSSEEDDUURR TTHHOORRAAKKOOSSKKOOPPII//MMEEDDIIAASSTTIINNOOSSKKOOPPII,1.734.900
411,50.0,102.5,452.8,786.3,92,J-2-32-0,PPRROOSSEEDDUURR DDAADDAA IINNTTEERRMMEEDDIIAATTEE,990.900
411,50.0,102.5,452.8,786.3,93,J-3-10-0,PPRROOSSEEDDUURR PPAADDAA DDIINNDDIINNGG DDAADDAA,739.300
411,50.0,102.5,452.8,786.3,94,J-3-11-0,PPRROOSSEEDDUURR PPEEMMAASSAANNGGAANN//PPEENNYYIISSIIPPAANN TTUUBBEE PPAADDAA DDAADDAA,914.300
411,50.0,102.5,452.8,786.3,95,J-3-12-0,PPRROOSSEEDDUURR TTHHOORRAACCEENNTTEESSIISS,629.500
411,50.0,102.5,452.8,786.3,96,J-3-13-0,PPRROOSSEEDDUURR TTEERRAAPPII SSAALLUURRAANN PPEERRNNAAFFAASSAANN,310.600
411,50.0,102.5,452.8,786.3,97,J-3-14-0,PPRROOSSEEDDUURR BBIIOOPPSSII PPEERRKKUUTTAANN DDAANN AASSPPIIRRAASSII,637.500
411,50.0,102.5,452.8,786.3,98,J-3-15-0,PPRROOSSEEDDUURR BBRROONNKKOOSSKKOOPPII,423.800
411,50.0,102.5,452.8,786.3,9,J-3-16-0,PPRROOSSEEDDUURR UUJJII FFUUNNGGSSII PPAARRUU,520.700
411,50.0,102.5,452.8,786.3,100,J-3-17-0,PPRROOSSEEDDUURR LLAAIINN--LLAAIINN PPAADDAA SSIISSTTEEMM SSAALLUURRAANN PPEERRNNAAFFAASSAANN,309.000
411,50.0,102.5,452.8,786.3,101,K-2-10-0,PPRROOSSEEDDUURR KKEECCIILL PPAADDAA UUSSUUSS BBEESSAARR DDAANN KKEECCIILL,888.500
411,50.0,102.5,452.8,786.3,102,K-2-11-0,PPRROOSSEEDDUURR AADDHHEESSIIOOLLYYSSIISS PPAADDAA PPEERRIITTOONNEEUUMM,1.676.900
411,50.0,102.5,452.8,786.3,103,K-2-12-0,PPRROOSSEEDDUURR PPAADDAA HHEERRNNIIAA TTIIDDAAKK TTEERRMMAASSUUKK HHEERRNNIIAA IINNGGUUIINNAALLIISS DDAANN FFEEMMOORRAALLIISS,1.029.800
411,50.0,102.5,452.8,786.3,104,K-2-13-0,PPRROOSSEEDDUURR PPAADDAA UUSSUUSS BBUUNNTTUU,2.588.000
411,50.0,102.5,452.8,786.3,105,K-2-14-0,PPRROOSSEEDDUURR PPAADDAA HHEERRNNIIAA IINNGGUUIINNAALLIISS DDAANN FFEEMMOORRAALLIISS,539.900
411,50.0,102.5,452.8,786.3,106,K-2-21-0,PPRROOSSEEDDUURR BBEESSAARR PPAADDAA UUSSUUSS HHAALLUUSS DDAANN UUSSUUSS BBEESSAARR,540.800
411,50.0,102.5,452.8,786.3,107,K-2-22-0,PPRROOSSEEDDUURR BBEESSAARR PPAADDAA GGAASSTTRROOIINNTTEESSTTIINNAALL AATTAASS,2.197.400
411,50.0,102.5,452.8,786.3,108,K-2-31-0,PPRROOSSEEDDUURR SSEEDDAANNGG PPAADDAA GGAASSTTRROOIINNTTEESSTTIINNAALL AATTAASS,1.245.400
411,50.0,102.5,452.8,786.3,109,K-2-32-0,PPRROOSSEEDDUURR LLAAIINN--LLAAIINN PPAADDAA GGAASSTTRROOIINNTTEESSTTIINNAALL AATTAASS,576.300
411,50.0,102.5,452.8,786.3,110,K-2-41-0,PPRROOSSEEDDUURR LLAAPPAARROOSSKKOOPPII,1.678.200
411,50.0,102.5,452.8,786.3,111,K-2-42-0,PPRROOSSEEDDUURR LLAAPPAARROOTTOOMMII && GGAASSTTRROOIINNTTEESSTTIINNAALL LLAAIINNNNYYAA,2.870.900
411,50.0,102.5,452.8,786.3,112,K-2-51-0,PPRROOSSEEDDUURR UUNNTTUUKK WWAASSIIRR,725.800
411,50.0,102.5,452.8,786.3,113,K-2-52-0,PPRROOSSEEDDUURR SSEEDDAANNGG PPAADDAA AANNUUSS && RREEKKTTUUMM,919.500
411,50.0,102.5,452.8,786.3,114,K-2-53-0,PPRROOSSEEDDUURR KKEECCIILL PPAADDAA AANNUUSS && RREEKKTTUUMM,353.400
411,50.0,102.5,452.8,786.3,115,K-3-10-0,PPRROOSSEEDDUURR KKEECCIILL LLAAIINN--LLAAIINN PPAADDAA GGAASSTTRROOIINNTTEESSTTIINNAALL,290.900
411,50.0,102.5,452.8,786.3,116,K-3-11-0,PPRROOSSEEDDUURR KKEECCIILL PPAADDAA AANNUUSS && RREEKKTTUUMM,322.300
411,50.0,102.5,452.8,786.3,117,K-3-12-0,PPRROOSSEEDDUURR SSIIGGMMOOIIDDOOSSKKOOPPII DDAANN AANNOOSSKKOOPPII,526.600
411,50.0,102.5,452.8,786.3,118,K-3-13-0,PPRROOSSEEDDUURR KKOOLLOONNOOSSKKOOPPII,2.000.800
411,50.0,102.5,452.8,786.3,119,K-3-14-0,PPRROOSSEEDDUURR EENNDDOOSSKKOOPPII BBEESSAARR PPAADDAA GGAASSTTRROOIINNTTEESSTTIINNAALL AATTAASS,1.262.600
411,50.0,102.5,452.8,786.3,120,K-3-15-0,PPRROOSSEEDDUURR EENNDDOOSSKKOOPPII KKEECCIILL PPAADDAA GGAASSTTRROOIINNTTEESSTTIINNAALL AATTAASS,1.067.500
411,50.0,102.5,452.8,786.3,121,K-3-16-0,PPRROOSSEEDDUURR LLAAIINN--LLAAIINN PPAADDAA GGAASSTTRROOIINNTTEESSTTIINNAALL,425.300
411,50.0,102.5,452.8,786.3,122,K-5-18-0,PPEENNYYAAKKIITT SSIISSTTEEMM PPEENNCCEERRNNAAAANN LLAAIINN--LLAAIINN,233.100
411,50.0,102.5,452.8,786.3,123,L-2-21-0,PPRROOSSEEDDUURR BBEESSAARR PPEEMMIINNDDAAHHAANN KKUULLIITT PPAADDAA LLUUKKAA BBAAKKAARR,1.235.800
411,50.0,102.5,452.8,786.3,124,L-2-22-0,PPRROOSSEEDDUURR KKEECCIILL PPEEMMIINNDDAAHHAANN KKUULLIITT PPAADDAA LLUUKKAA BBAAKKAARR,792.200
411,50.0,102.5,452.8,786.3,125,L-2-31-0,PPRROOSSEEDDUURR BBEESSAARR PPEEMMIINNDDAAHHAANN KKUULLIITT TTAANNPPAA LLUUKKAA BBAAKKAARR,816.200
411,50.0,102.5,452.8,786.3,126,L-2-32-0,PPRROOSSEEDDUURR KKEECCIILL PPEEMMIINNDDAAHHAANN KKUULLIITT TTAANNPPAA LLUUKKAA BBAAKKAARR,670.900
411,50.0,102.5,452.8,786.3,127,L-2-41-0,PPRROOSSEEDDUURR BBEEDDAAHH PPLLAASSTTIIKK,1.315.900
411,50.0,102.5,452.8,786.3,128,L-2-42-0,PPRROOSSEEDDUURR LLAAIINN--LLAAIINN PPAADDAA KKUULLIITT DDAANN JJAARRIINNGGAANN BBAAWWAAHH KKUULLIITT,492.600
411,50.0,102.5,452.8,786.3,129,L-2-51-0,PPRROOSSEEDDUURR PPEENNGGAANNGGKKAATTAANN PPAAYYUUDDAARRAA,2.078.500
411,50.0,102.5,452.8,786.3,130,L-2-52-0,PPRROOSSEEDDUURR BBEESSAARR PPAADDAA PPAAYYUUDDAARRAA TTAANNPPAA PPEENNGGAANNGGKKAATTAANN PPAAYYUUDDAARRAA,1.322.500
411,50.0,102.5,452.8,786.3,131,L-2-53-0,PPRROOSSEEDDUURR KKEECCIILL PPAADDAA PPAAYYUUDDAARRAA TTAANNPPAA PPEENNGGAANNGGKKAATTAANN PPAAYYUUDDAARRAA,843.200
411,50.0,102.5,452.8,786.3,132,L-3-10-0,PPRROOSSEEDDUURR KKEECCIILL LLAAIINN--LLAAIINN PPAADDAA PPAAYYUUDDAARRAA,553.500
411,50.0,102.5,452.8,786.3,133,L-3-11-0,PPRROOSSEEDDUURR BBEESSAARR PPAADDAA KKUULLIITT,382.500
411,50.0,102.5,452.8,786.3,134,L-3-12-0,PPRROOSSEEDDUURR KKEECCIILL PPAADDAA KKUULLIITT,276.700
411,50.0,102.5,452.8,786.3,135,M-2-10-0,PPRROOSSEEDDUURR RREEKKOONNTTRRUUKKSSII TTUULLAANNGG KKRRAANNIIAALL DDAANN WWAAJJAAHH,1.445.300
411,50.0,102.5,452.8,786.3,136,M-2-21-0,PPRROOSSEEDDUURR BBEESSAARR PPAADDAA SSEENNDDII PPAANNGGGGUULL DDAANN PPAAHHAA,1.686.600
411,50.0,102.5,452.8,786.3,137,M-2-22-0,PPRROOSSEEDDUURR KKEECCIILL PPAADDAA SSEENNDDII PPAANNGGGGUULL DDAANN PPAAHHAA,398.800
411,50.0,102.5,452.8,786.3,138,M-2-31-0,PPRROOSSEEDDUURR BBUUNNIIOONN,896.700
411,50.0,102.5,452.8,786.3,139,M-2-32-0,PPRROOSSEEDDUURR LLAAIINN--LLAAIINN PPAADDAA KKAAKKII,450.000
411,50.0,102.5,452.8,786.3,140,M-2-41-0,"PPRROOSSEEDDUURR EEKKSSIISSII,, IINNSSIISSII DDAANN AARRTTHHRROOTTOOMMII TTUULLAANNGG",589.400
411,50.0,102.5,452.8,786.3,141,M-2-42-0,PPRROOSSEEDDUURR PPEEMMIINNDDAAHHAANN AALLAATT IIMMPPLLAANN,442.900
411,50.0,102.5,452.8,786.3,142,M-2-51-0,PPRROOSSEEDDUURR BBEESSAARR PPAADDAA JJAARRIINNGGAANN LLUUNNAAKK,619.900
411,50.0,102.5,452.8,786.3,143,M-2-52-0,PPRROOSSEEDDUURR KKEECCIILL PPAADDAA JJAARRIINNGGAANN LLUUNNAAKK,570.900
411,50.0,102.5,452.8,786.3,144,M-2-61-0,PPRROOSSEEDDUURR AARRTTRROOSSKKOOPPII,1.250.300
411,50.0,102.5,452.8,786.3,145,M-2-62-0,PPRROOSSEEDDUURR LLAAIINN--LLAAIINN PPAADDAA SSEENNDDII && TTUULLAANNGG,348.100
411,50.0,102.5,452.8,786.3,146,M-2-63-0,"PPRROOSSEEDDUURR IINNSSIISSII,, BBIIOOPPSSII DDAANN GGRRAAFFTT PPAADDAA TTUULLAANNGG",908.800
411,50.0,102.5,452.8,786.3,147,M-2-64-0,PPRROOSSEEDDUURR BBEESSAARR PPAADDAA TTUULLAANNGG KKEEPPAALLAA && WWAAJJAAHH,1.123.500
411,50.0,102.5,452.8,786.3,148,M-2-65-0,PPRROOSSEEDDUURR KKEECCIILL PPAADDAA TTUULLAANNGG KKEEPPAALLAA && WWAAJJAAHH,292.200
411,50.0,102.5,452.8,786.3,149,M-2-71-0,PPRROOSSEEDDUURR BBEESSAARR PPAADDAA LLUUTTUUTT && TTUUNNGGKKAAII BBAAWWAAHH,1.628.600
411,50.0,102.5,452.8,786.3,150,M-2-72-0,PPRROOSSEEDDUURR KKEECCIILL PPAADDAA LLUUTTUUTT && TTUUNNGGKKAAII BBAAWWAAHH,883.800
411,50.0,102.5,452.8,786.3,151,M-2-81-0,"PPRROOSSEEDDUURR BBEESSAARR PPAADDAA LLEENNGGAANN,, SSIIKKUU && BBAAHHUU",1.927.700
411,50.0,102.5,452.8,786.3,152,M-2-82-0,"PPRROOSSEEDDUURR KKEECCIILL PPAADDAA LLEENNGGAANN,, SSIIKKUU && BBAAHHUU",966.900
411,50.0,102.5,452.8,786.3,153,M-2-83-0,PPRROOSSEEDDUURR BBEESSAARR PPAADDAA TTAANNGGAANN && PPEERRGGEELLAANNGGAANN TTAANNGGAANN,899.100
411,50.0,102.5,452.8,786.3,154,M-2-84-0,PPRROOSSEEDDUURR KKEECCIILL PPAADDAA TTAANNGGAANN && PPEERRGGEELLAANNGGAANN TTAANNGGAANN,556.200
411,50.0,102.5,452.8,786.3,155,M-3-10-0,PPRROOSSEEDDUURR MMAANNIIPPUULLAATTIIVVEE OOSSTTEEOOPPAATTHHIICC,108.100
411,50.0,102.5,452.8,786.3,156,M-3-11-0,PPRROOSSEEDDUURR DDIIAAGGNNOOSSTTIIKK DDAANN TTEERRAAPPEEUUTTIIKK MMUUSSKKUULLOOSSKKEELLEETTAALL,408.000
411,50.0,102.5,452.8,786.3,157,M-3-12-0,PPRROOSSEEDDUURR BBIIOOPPSSII SSEENNDDII DDAANN TTRRAAKKSSII SSKKEELLEETTAALL,880.800
411,50.0,102.5,452.8,786.3,158,M-3-13-0,PPRROOSSEEDDUURR RREEDDUUKKSSII FFRRAAKKTTUURR TTEERRTTUUTTUUPP,578.600
411,50.0,102.5,452.8,786.3,159,M-3-14-0,PPRROOSSEEDDUURR RREEDDUUKKSSII FFRRAAKKTTUURR WWAAJJAAHH TTEERRTTUUTTUUPP,512.900
412,50.0,102.5,452.8,786.3,160,M-3-15-0,PPRROOSSEEDDUURR AAPPLLIIKKAASSII CCAASSTTSS DDAANN SSPPLLIINNTTSS,385.900
412,50.0,102.5,452.8,786.3,161,M-3-16-0,PPRROOSSEEDDUURR TTHHEERRAAPPII FFIISSIIKK DDAANN PPRROOSSEEDDUURR KKEECCIILL MMUUSSKKUULLOOSSKKLLEETTAALL,123.400
412,50.0,102.5,452.8,786.3,162,M-3-17-0,PPRROOSSEEDDUURR PPEEMMAASSAANNGGAANN AALLAATT PPRROOSSTTEETTIIKK,280.900
412,50.0,102.5,452.8,786.3,163,N-2-11-0,PPRROOSSEEDDUURR BBEESSAARR PPAADDAA KKAANNDDUUNNGG KKEEMMIIHH,4.225.900
412,50.0,102.5,452.8,786.3,164,N-2-12-0,"PPRROOSSEEDDUURR MMEEMMBBUUAATT BBAARRUU,, MMEERREEVVIISSII DDAANN MMEEMMIINNDDAAHHKKAANN AALLAATT DDIIAALLIISSIISS",2.779.200
412,50.0,102.5,452.8,786.3,165,N-2-21-0,EEXXTTRRAACCOORRPPOORREEAALL SSHHOOCCKKWWAAVVEE LLIITTHHOOTTRRIIPPSSYY ((EESSWWLL)) PPAADDAA SSAALLUURRAANN KKEEMMIIHH,3.971.900
412,50.0,102.5,452.8,786.3,166,N-2-22-0,PPRROOSSEEDDUURR BBEESSAARR PPAADDAA GGIINNJJAALL DDAANN UURREETTEERR,1.889.900
412,50.0,102.5,452.8,786.3,167,N-2-23-0,PPRROOSSEEDDUURR SSEEDDAANNGG PPAADDAA GGIINNJJAALL DDAANN UURREETTEERR,1.289.100
412,50.0,102.5,452.8,786.3,168,N-2-24-0,PPRROOSSEEDDUURR KKEECCIILL PPAADDAA GGIINNJJAALL DDAANN UURREETTEERR,911.700
412,50.0,102.5,452.8,786.3,169,N-2-31-0,PPRROOSSEEDDUURR BBEESSAARR PPAADDAA KKAANNDDUUNNGG KKEEMMIIHH DDAANN UURREETTHHRRAA,1.085.000
412,50.0,102.5,452.8,786.3,170,N-2-32-0,PPRROOSSEEDDUURR KKEECCIILL PPAADDAA KKAANNDDUUNNGG KKEEMMIIHH DDAANN UURREETTHHRRAA,648.200
412,50.0,102.5,452.8,786.3,171,N-2-41-0,PPRROOSSEEDDUURR BBEESSAARR PPAADDAA UURREETTHHRRAA DDAANN TTRRAANNSSUURREETTHHRRAA,1.281.800
412,50.0,102.5,452.8,786.3,172,N-2-42-0,PPRROOSSEEDDUURR KKEECCIILL PPAADDAA UURREETTHHRRAA DDAANN TTRRAANNSSUURREETTHHRRAA,761.100
412,50.0,102.5,452.8,786.3,173,N-3-10-0,PPRROOSSEEDDUURR PPAADDAA GGIINNJJAALL DDAANN UURREETTEERR,347.500
412,50.0,102.5,452.8,786.3,174,N-3-11-0,PPRROOSSEEDDUURR DDIIAAGGNNOOSSTTIIKK LLAAIINN PPAADDAA SSTTUUDDII SSAALLUURRAANN KKEEMMIIHH,491.400
412,50.0,102.5,452.8,786.3,175,N-3-12-0,PPRROOSSEEDDUURR CCYYSSTTOOSSCCOOPPII && PPRROOSSEEDDUURR KKEECCIILL EENNDDOOSSKKOOPPII SSAALLUURRAANN KKEEMMIIHH,898.800
412,50.0,102.5,452.8,786.3,176,N-3-13-0,PPRROOSSEEDDUURR BBEESSAARR EENNDDOOSSKKOOPPII PPAADDAA SSAALLUURRAANN KKEEMMIIHH,979.900
412,50.0,102.5,452.8,786.3,177,N-3-14-0,PPRROOSSEEDDUURR KKEECCIILL EENNDDOOSSKKOOPPII PPAADDAA SSAALLUURRAANN KKEEMMIIHH,350.800
412,50.0,102.5,452.8,786.3,178,N-3-15-0,PPRROOSSEEDDUURR DDIIAALLIISSIISS,804.300
412,50.0,102.5,452.8,786.3,179,O-7-10-0,PPRROOSSEEDDUURR PPEERRSSAALLIINNAANN DDEENNGGAANN BBEEDDAAHH CCAAEESSAARR,2.118.200
412,50.0,102.5,452.8,786.3,180,O-7-11-0,PPEERRSSAALLIINNAANN VVAAGGIINNAALL DDEENNGGAANN SSTTEERRIILLIISSAASSII DDAANN AATTAAUU PPEELLEEBBAARRAANN DDAANN KKUURREETTAASSEE,1.898.100
412,50.0,102.5,452.8,786.3,181,O-7-12-0,PPRROOSSEEDDUURR PPEERRSSAALLIINNAANN VVAAGGIINNAALL DDEENNGGAANN PPRROOSSEEDDUURR SSEELLAAIINN SSTTEERRIILLIISSAASSII DDAANN AATTAAUU PPEELLEEBBAARRAANN DDAANN KKUURREETTAASSEE,1.677.300
412,50.0,102.5,452.8,786.3,182,O-7-13-0,PPRROOSSEEDDUURR PPEERRSSAALLIINNAANN MMEELLAALLUUII VVAAGGIINNAALL//JJAALLAANN LLAAHHIIRR,1.272.700
412,50.0,102.5,452.8,786.3,183,P-9-11-0,"NNEEOONNAATTAALL,, BBBBLL GGRROOUUPP--22",410.000
412,50.0,102.5,452.8,786.3,184,P-9-12-0,"NNEEOONNAATTAALL,, BBBBLL GGRROOUUPP--33",397.300
412,50.0,102.5,452.8,786.3,185,P-9-13-0,"NNEEOONNAATTAALL,, BBBBLL GGRROOUUPP--44",319.100
412,50.0,102.5,452.8,786.3,186,P-9-14-0,"NNEEOONNAATTAALL,, BBBBLL GGRROOUUPP--55 DDEENNGGAANN AANNOOMMAALLII MMAAYYOORR AATTAAUU KKOONNDDIISSII HHEERREEDDIITTEERR",277.100
412,50.0,102.5,452.8,786.3,187,P-9-15-0,"NNEEOONNAATTAALL,, BBBBLL GGRROOUUPP--55 DDEENNGGAANN SSIINNDDRROOMM AASSPPIIRRAASSII",233.100
412,50.0,102.5,452.8,786.3,188,P-9-16-0,"NNEEOONNAATTAALL,, BBBBLL GGRROOUUPP--55 DDEENNGGAANN KKOONNGGEENNIITTAALL//IINNFFEEKKSSII PPEERRIINNAATTAALL",262.800
412,50.0,102.5,452.8,786.3,189,P-9-17-0,"NNEEOONNAATTAALL,, BBBBLL GGRROOUUPP--55",283.100
412,50.0,102.5,452.8,786.3,190,Q-5-10-0,PPEENNYYAALLAAHHGGUUNNAAAANN ZZAATT KKIIMMIIAA AAKKUUTT,306.200
412,50.0,102.5,452.8,786.3,191,Q-5-11-0,PPEENNYYAALLAAHHGGUUNNAAAANN ZZAATT KKIIMMIIAA BBUUKKAANN AAKKUUTT,225.600
412,50.0,102.5,452.8,786.3,192,Q-5-12-0,GIGI,230.000
412,50.0,102.5,452.8,786.3,193,Q-5-13-0,MMEEDDIICCAALL CCHHEECCKK--UUPP,128.400
412,50.0,102.5,452.8,786.3,194,Q-5-14-0,RROONNGGEENNTT ((PPLLAAIINN FFIILLMM)),165.100
412,50.0,102.5,452.8,786.3,195,Q-5-15-0,EELLEEKKTTRROOKKAARRDDIIOOGGRRAAMM ((EECCGG)),79.900
412,50.0,102.5,452.8,786.3,196,Q-5-16-0,VAKSINASI,91.200
412,50.0,102.5,452.8,786.3,197,Q-5-17-0,PPAASSAANNGG IINNFFUUSS,89.500
412,50.0,102.5,452.8,786.3,198,Q-5-18-0,KKOONNSSUULLTTAASSII AATTAAUU PPEEMMEERRIIKKSSAAAANN LLAAIINN--LLAAIINN,138.700
412,50.0,102.5,452.8,786.3,199,Q-5-19-0,KKOONNTTAAKK PPEELLAAYYAANNAANN KKEESSEEHHAATTAANN LLAAIINN--LLAAIINN,143.900
412,50.0,102.5,452.8,786.3,200,Q-5-20-0,AABBOORRSSII MMEENNGGAANNCCAAMM,200.500
412,50.0,102.5,452.8,786.3,201,Q-5-21-0,ABORSI,212.600
412,50.0,102.5,452.8,786.3,202,Q-5-22-0,PPEERRSSAALLIINNAANN YYAANNGG SSUUKKAARR ((FFAALLSSEE LLAABBOORR)),132.900
412,50.0,102.5,452.8,786.3,203,Q-5-23-0,PPEEMMEERRIIKKSSAAAANN AANNTTEEPPAARRTTUUMM,132.700
412,50.0,102.5,452.8,786.3,204,Q-5-24-0,PPEEMMEERRIIKKSSAAAANN PPOOSSTTPPAARRTTUUMM,81.800
412,50.0,102.5,452.8,786.3,205,Q-5-25-0,GGAASSTTRROOIINNTTEESSTTIINNAALL AAKKUUTT,150.700
412,50.0,102.5,452.8,786.3,206,Q-5-26-0,BBRROONNKKIIAALL AAKKUUTT,195.100
412,50.0,102.5,452.8,786.3,207,Q-5-27-0,SSIISSTTEEMM PPEERRSSAARRAAFFAANN PPUUSSAATT AAKKUUTT,146.500
412,50.0,102.5,452.8,786.3,208,Q-5-28-0,KKEECCEEDDEERRAAAANN SSIISSTTEEMM PPEERRSSAARRAAFFAANN PPUUSSAATT,210.300
412,50.0,102.5,452.8,786.3,209,Q-5-29-0,GGAAGGAALL JJAANNTTUUNNGG KKOONNGGEESSTTIIFF DDAANN KKOONNDDIISSII JJAANNTTUUNNGG LLAAIINN--LLAAIINN,501.700
412,50.0,102.5,452.8,786.3,210,Q-5-30-0,IINNFFAARRKK MMIIOOKKAARRDD AAKKUUTT DDAANN AARRIITTMMIIAA,581.500
412,50.0,102.5,452.8,786.3,211,Q-5-31-0,FRAKTUR,162.400
412,50.0,102.5,452.8,786.3,212,Q-5-32-0,SSAALLUURRAANN KKEEMMIIHH AAKKUUTT,241.400
412,50.0,102.5,452.8,786.3,213,Q-5-33-0,HHEEMMAATTOOLLOOGGII AAKKUUTT,173.500
412,50.0,102.5,452.8,786.3,214,Q-5-34-0,IINNFFEEKKSSII VVIIRRUUSS HHIIVV,211.100
412,50.0,102.5,452.8,786.3,215,Q-5-35-0,IINNFFEEKKSSII AAKKUUTT,406.100
412,50.0,102.5,452.8,786.3,216,Q-5-36-0,KKEEKKAACCAAUUAANN MMEETTAABBOOLLIIKK AAKKUUTT,347.700
