page,bbox_x0,bbox_top,bbox_x1,bbox_bottom,NO,KKOODDEE IINNAA--CCBBGG,DESKRIPSI KODE INA-CBG,TTAARRIIFF IINNAA--CCBBGG
550,50.0,109.4,452.8,784.8,1,B-2-10-0,PROSEDUR PADA HATI DAN PANKREAS,1.473.500
550,50.0,109.4,452.8,784.8,2,B-2-11-0,PROSEDUR BESAR PADA SALURAN EMPEDU,1.911.200
550,50.0,109.4,452.8,784.8,3,B-2-12-0,PROSEDUR KOLESISTEKTOMI TANPA LAPAROSKOPI,3.554.200
550,50.0,109.4,452.8,784.8,4,B-2-13-0,PROSEDUR LAIN-LAIN PADA HEPATOBILIARI & PANKREAS,3.671.400
550,50.0,109.4,452.8,784.8,5,B-2-14-0,PROSEDUR KOLESISTEKTOMI DENGAN LAPAROSKOPI,3.927.900
550,50.0,109.4,452.8,784.8,6,B-3-10-0,PROSEDUR PADA PERKUTAN HATI & SALURAN EMPEDU,1.367.800
550,50.0,109.4,452.8,784.8,7,B-3-11-0,PROSEDUR ENDOSKOPI SALURAN EMPEDU,1.778.200
550,50.0,109.4,452.8,784.8,8,B-3-12-0,PROSEDUR LAIN-LAIN PADA SISTEM HEPATOBILIARI DAN PANKREAS,549.000
550,50.0,109.4,452.8,784.8,9,C-3-10-0,PROSEDUR RADIOTERAPI,1.213.100
550,50.0,109.4,452.8,784.8,10,C-3-11-0,KEMOTERAPI PADA TUMOR PARU & KANDUNG KEMIH,1.098.200
550,50.0,109.4,452.8,784.8,1,C-3-12-0,KEMOTERAPI PADA TUMOR KOLON,1.196.000
550,50.0,109.4,452.8,784.8,12,C-3-13-0,KEMOTERAPI PADA TUMOR PAYUDARA ATAU OVARIUM,1.775.500
550,50.0,109.4,452.8,784.8,13,C-3-14-0,KEMOTERAPI PADA TUMOR GASTROINTESTINAL,2.421.600
550,50.0,109.4,452.8,784.8,14,C-3-15-0,"KEMOTERAPI PADA TUMOR MELANOMA, GINJAL ATAU PROSTAT",2.219.500
550,50.0,109.4,452.8,784.8,15,C-3-16-0,KEMOTERAPI PADA TUMOR OTAK,834.000
550,50.0,109.4,452.8,784.8,16,C-3-17-0,KEMOTERAPI PADA TUMOR KEPALA ATAU LEHER,1.694.400
550,50.0,109.4,452.8,784.8,17,C-3-18-0,KEMOTERAPI PADA LEUKEMIA AKUT,775.300
550,50.0,109.4,452.8,784.8,18,C-3-19-0,"KEMOTERAPI PADA TUMOR LIMFOMA, MYELOMA ATAU TESTIS",1.404.800
550,50.0,109.4,452.8,784.8,19,C-3-20-0,KEMOTERAPI PADA TUMOR KULIT,3.148.100
550,50.0,109.4,452.8,784.8,20,C-3-21-0,KEMOTERAPI PADA TUMOR GINEKOLOGI,1.501.500
550,50.0,109.4,452.8,784.8,21,C-3-22-0,KEMOTERAPI PADA TUMOR METASTASE,2.662.500
550,50.0,109.4,452.8,784.8,2,C-3-23-0,KEMOTERAPI PADA TUMOR LAIN-LAIN,649.600
550,50.0,109.4,452.8,784.8,23,D-2-10-0,PROSEDUR PENCANGKOKAN SUMSUM TULANG,1.894.300
550,50.0,109.4,452.8,784.8,24,D-2-11-0,PROSEDUR LIMPA,2.712.000
550,50.0,109.4,452.8,784.8,25,D-2-21-0,PROSEDUR BESAR PADA NODUL LIMPA DAN TYMUS,2.709.900
550,50.0,109.4,452.8,784.8,26,D-2-22-0,PROSEDUR KECIL PADA NODUL LIMPA DAN TYMUS,666.100
550,50.0,109.4,452.8,784.8,27,D-3-10-0,PROSEDUR TRANSFUSI & TERAPI SUMSUM TULANG,1.599.500
550,50.0,109.4,452.8,784.8,28,D-3-11-0,PROSEDUR DIAGNOSTIK DARAH DAN ORGAN PEMBENTUK DARAH,1.308.000
550,50.0,109.4,452.8,784.8,29,E-2-10-0,PROSEDUR PADA KELENJAR ADRENAL,786.000
550,50.0,109.4,452.8,784.8,30,E-2-21-0,PROSEDUR BESAR PADA KELENJAR TIROID DAN PARATIROID,983.200
550,50.0,109.4,452.8,784.8,31,E-2-22-0,"PROSEDUR KECIL PADA KELENJAR TIROID,PARATIROID DAN SALURAN THYROGLOSSAL",765.800
550,50.0,109.4,452.8,784.8,32,E-3-10-0,PROSEDUR DIAGNOSTIK PADA KELENJAR ENDOKRIN,672.200
550,50.0,109.4,452.8,784.8,3,F-3-10-0,TERAPI SHOCK,732.200
550,50.0,109.4,452.8,784.8,34,F-5-10-0,PELAYANAN KESEHATAN MENTAL EKSTENSIF,499.800
550,50.0,109.4,452.8,784.8,35,F-5-11-0,TERAPI KELOMPOK,543.400
550,50.0,109.4,452.8,784.8,36,F-5-12-0,PROSEDUR TES DIAGNOSTIK KESEHATAN JIWA,443.100
550,50.0,109.4,452.8,784.8,37,F-5-13-0,PSIKOTERAPI INDIVIDU DEWASA AKUT,724.800
550,50.0,109.4,452.8,784.8,38,F-5-14-0,PSIKOTHERAPI INDIVIDU DEWASA BUKAN AKUT,375.700
550,50.0,109.4,452.8,784.8,39,F-5-15-0,PENGOBATAN INDIVIDU KETERBELAKANGAN MENTAL,372.900
550,50.0,109.4,452.8,784.8,40,F-5-16-0,PSIKOTHERAPI INDIVIDU PADA KANAK-KANAK MASALAH KESEHATAN MENTAL,394.800
550,50.0,109.4,452.8,784.8,41,G-2-10-0,PROSEDUR KRANIOTOMI,8.674.700
550,50.0,109.4,452.8,784.8,42,G-2-11-0,PROSEDUR SHUNT VENTRIKEL,4.178.800
550,50.0,109.4,452.8,784.8,43,G-2-12-0,PROSEDUR PADA PEMBULUH DARAH EKSTRAKRANIAL,3.478.600
550,50.0,109.4,452.8,784.8,4,G-2-13-0,PROSEDUR CARPAL TUNNEL RELEASE,1.210.400
550,50.0,109.4,452.8,784.8,45,G-2-21-0,PROSEDUR BESAR PADA SARAF PERIFER,2.736.300
550,50.0,109.4,452.8,784.8,46,G-2-22-0,PROSEDUR KECIL PADA SARAF PERIFER,1.534.200
550,50.0,109.4,452.8,784.8,47,G-2-31-0,PROSEDUR BESAR PADA TULANG BELAKANG,2.739.100
550,50.0,109.4,452.8,784.8,48,G-2-32-0,PROSEDUR KECIL PADA TULANG BELAKANG,1.861.600
550,50.0,109.4,452.8,784.8,49,G-3-10-0,PROSEDUR TAP & INJEKSI PADA SPINAL,841.700
550,50.0,109.4,452.8,784.8,50,G-3-11-0,PROSEDUR INJEKSI PADA SARAF PERIFER,608.900
550,50.0,109.4,452.8,784.8,51,G-3-12-0,PROSEDUR PEMERIKSAAN NEUROLOGIS LAIN,833.300
550,50.0,109.4,452.8,784.8,52,G-3-13-0,PROSEDUR ELEKROENSEFALOGRAFI (EEG),632.300
550,50.0,109.4,452.8,784.8,53,G-5-17-0,PENYAKIT SARAF KRANIAL DAN SARAF PERIFER LAIN-LAIN,393.800
550,50.0,109.4,452.8,784.8,54,H-2-21-0,PROSEDUR BESAR PADA MATA,3.841.100
550,50.0,109.4,452.8,784.8,5,H-2-22-0,PROSEDUR SEDANG PADA MATA,1.899.100
550,50.0,109.4,452.8,784.8,56,H-2-23-0,PROSEDUR KECIL PADA MATA,1.024.300
550,50.0,109.4,452.8,784.8,57,H-2-31-0,PROSEDUR BESAR PADA SEGMEN ANTERIOR MATA,4.278.400
550,50.0,109.4,452.8,784.8,58,H-2-32-0,PROSEDUR SEDANG PADA SEGMEN ANTERIOR MATA,2.895.700
550,50.0,109.4,452.8,784.8,59,H-2-33-0,PROSEDUR KECIL PADA SEGMEN ANTERIOR MATA,540.500
550,50.0,109.4,452.8,784.8,60,H-2-34-0,PROSEDUR BESAR PADA SEGMEN POSTERIOR MATA,4.331.700
550,50.0,109.4,452.8,784.8,61,H-2-35-0,PROSEDUR KECIL PADA SEGMEN POSTERIOR MATA,3.266.700
550,50.0,109.4,452.8,784.8,62,H-2-36-0,PROSEDUR OPERASI KATARAK,4.674.700
550,50.0,109.4,452.8,784.8,63,H-2-37-0,PROSEDUR PHOTOKOAGULASI DAN KRIOTHERAPI PADA RETINA,1.761.700
550,50.0,109.4,452.8,784.8,64,H-3-10-0,PROSEDUR LASER SEDANG PADA MATA,1.067.600
550,50.0,109.4,452.8,784.8,65,H-3-11-0,PROSEDUR KECIL PADA EKTRAOKULER,449.600
550,50.0,109.4,452.8,784.8,6,H-3-12-0,PROSEDUR LAIN-LAIN PADA MATA,407.900
550,50.0,109.4,452.8,784.8,67,H-3-13-0,PROSEDUR DIAGNOSTIK & IMAGING PADA MATA,426.000
550,50.0,109.4,452.8,784.8,68,I-2-11-0,PEMASANGAN/PENYISIPAN DEFIBRILATOR JANTUNG & SISTEM BANTU JANTUNG,5.904.600
550,50.0,109.4,452.8,784.8,69,I-2-12-0,PROSEDUR BESAR PADA PEMBULUH DARAH TORASIK,3.312.600
550,50.0,109.4,452.8,784.8,70,I-2-13-0,PROSEDUR BESAR PADA PEMBULUH DARAH ABDOMEN,3.653.000
550,50.0,109.4,452.8,784.8,71,I-2-14-0,PROSEDUR PEMASANGAN/PENYISIPAN ALAT PACU PERMANEN PADA JANTUNG,7.469.600
550,50.0,109.4,452.8,784.8,72,I-2-15-0,PROSEDUR KATETERISASI JANTUNG,6.868.500
550,50.0,109.4,452.8,784.8,73,I-2-16-0,PROSEDUR REVISI DEFIBRILATOR DAN ALAT PACU JANTUNG TIDAK TERMASUK PENGGANTIAN ALAT,4.083.300
550,50.0,109.4,452.8,784.8,74,I-2-17-0,PROSEDUR LIGASI DAN STRIPPING PEMBULUH DARAH VENA,1.350.900
550,50.0,109.4,452.8,784.8,75,I-2-21-0,ANGIOGRAFI ARTERI BUKAN JANTUNG,4.544.800
550,50.0,109.4,452.8,784.8,76,I-2-22-0,PROSEDUR SEDANG PADA PEMBULUH DARAH,2.967.500
550,50.0,109.4,452.8,784.8,7,I-2-23-0,PROSEDUR KECIL PADA PEMBULUH DARAH,797.000
550,50.0,109.4,452.8,784.8,78,I-2-31-0,PEMASANGAN ATAU PENGGANTIAN ALAT DEFIBRILATOR JANTUNG,7.883.800
550,50.0,109.4,452.8,784.8,79,I-2-32-0,PEMASANGAN ATAU PENGGANTIAN ALAT PACU JANTUNG,7.137.100
551,50.0,102.5,452.8,786.3,80,I-2-41-0,PROSEDUR ELEKTROFISIOLOGIK,4.785.400
551,50.0,102.5,452.8,786.3,81,I-2-42-0,PROSEDUR ANGIOPLASTI PEMBULUH DARAH KORONER DAN KARDIOVASKULAR PERKUTAN LAIN,4.562.100
551,50.0,102.5,452.8,786.3,82,I-3-10-0,PROSEDUR RESUSITASI,1.092.500
551,50.0,102.5,452.8,786.3,83,I-3-11-0,PROSEDUR KARDIOVERSI,991.100
551,50.0,102.5,452.8,786.3,84,I-3-12-0,PROSEDUR KECIL LAIN-LAIN PADA JANTUNG,1.875.100
551,50.0,102.5,452.8,786.3,85,I-3-13-0,PROSEDUR EKOKARDIOGRAFI,546.700
551,50.0,102.5,452.8,786.3,86,I-3-14-0,PROSEDUR STRESS TESTING,503.600
551,50.0,102.5,452.8,786.3,87,I-3-15-0,PROSEDUR PENGAWASAN FUNGSI KARDIOVASKULAR,504.600
551,50.0,102.5,452.8,786.3,8,J-2-10-0,PROSEDUR BESAR PADA SISTEM SALURAN PERNAFASAN,2.537.600
551,50.0,102.5,452.8,786.3,89,J-2-21-0,PROSEDUR VENTILASI MEKANIKAL JANGKA PENDEK,2.625.800
551,50.0,102.5,452.8,786.3,90,J-2-22-0,PROSEDUR PADA LARING DAN TRAKEA,2.066.400
551,50.0,102.5,452.8,786.3,91,J-2-31-0,PROSEDUR THORAKOSKOPI/MEDIASTINOSKOPI,2.313.900
551,50.0,102.5,452.8,786.3,92,J-2-32-0,PROSEDUR DADA INTERMEDIATE,1.381.600
551,50.0,102.5,452.8,786.3,93,J-3-10-0,PROSEDUR PADA DINDING DADA,936.700
551,50.0,102.5,452.8,786.3,94,J-3-11-0,PROSEDUR PEMASANGAN/PENYISIPAN TUBE PADA DADA,1.219.500
551,50.0,102.5,452.8,786.3,95,J-3-12-0,PROSEDUR THORACENTESIS,839.600
551,50.0,102.5,452.8,786.3,96,J-3-13-0,PROSEDUR TERAPI SALURAN PERNAFASAN,501.800
551,50.0,102.5,452.8,786.3,97,J-3-14-0,PROSEDUR BIOPSI PERKUTAN DAN ASPIRASI,807.800
551,50.0,102.5,452.8,786.3,98,J-3-15-0,PROSEDUR BRONKOSKOPI,621.700
551,50.0,102.5,452.8,786.3,9,J-3-16-0,PROSEDUR UJI FUNGSI PARU,707.800
551,50.0,102.5,452.8,786.3,100,J-3-17-0,PROSEDUR LAIN-LAIN PADA SISTEM SALURAN PERNAFASAN,414.900
551,50.0,102.5,452.8,786.3,101,K-2-10-0,PROSEDUR KECIL PADA USUS BESAR DAN KECIL,1.190.900
551,50.0,102.5,452.8,786.3,102,K-2-11-0,PROSEDUR ADHESIOLYSIS PADA PERITONEUM,2.236.600
551,50.0,102.5,452.8,786.3,103,K-2-12-0,PROSEDUR PADA HERNIA TIDAK TERMASUK HERNIA INGUINALIS DAN FEMORALIS,1.666.000
551,50.0,102.5,452.8,786.3,104,K-2-13-0,PROSEDUR PADA USUS BUNTU,3.916.600
551,50.0,102.5,452.8,786.3,105,K-2-14-0,PROSEDUR PADA HERNIA INGUINALIS DAN FEMORALIS,853.000
551,50.0,102.5,452.8,786.3,106,K-2-21-0,PROSEDUR BESAR PADA USUS HALUS DAN USUS BESAR,988.700
551,50.0,102.5,452.8,786.3,107,K-2-22-0,PROSEDUR BESAR PADA GASTROINTESTINAL ATAS,4.523.900
551,50.0,102.5,452.8,786.3,108,K-2-31-0,PROSEDUR SEDANG PADA GASTROINTESTINAL ATAS,2.104.500
551,50.0,102.5,452.8,786.3,109,K-2-32-0,PROSEDUR LAIN-LAIN PADA GASTROINTESTINAL ATAS,730.200
551,50.0,102.5,452.8,786.3,110,K-2-41-0,PROSEDUR LAPAROSKOPI,2.260.900
551,50.0,102.5,452.8,786.3,111,K-2-42-0,PROSEDUR LAPAROTOMI & GASTROINTESTINAL LAINNYA,4.851.500
551,50.0,102.5,452.8,786.3,112,K-2-51-0,PROSEDUR UNTUK WASIR,1.113.900
551,50.0,102.5,452.8,786.3,113,K-2-52-0,PROSEDUR SEDANG PADA ANUS & REKTUM,1.226.500
551,50.0,102.5,452.8,786.3,114,K-2-53-0,PROSEDUR KECIL PADA ANUS & REKTUM,471.300
551,50.0,102.5,452.8,786.3,115,K-3-10-0,PROSEDUR KECIL LAIN-LAIN PADA GASTROINTESTINAL,387.900
551,50.0,102.5,452.8,786.3,116,K-3-11-0,PROSEDUR KECIL PADA ANUS & REKTUM,582.000
551,50.0,102.5,452.8,786.3,117,K-3-12-0,PROSEDUR SIGMOIDOSKOPI DAN ANOSKOPI,1.112.100
551,50.0,102.5,452.8,786.3,118,K-3-13-0,PROSEDUR KOLONOSKOPI,2.838.900
551,50.0,102.5,452.8,786.3,119,K-3-14-0,PROSEDUR ENDOSKOPI BESAR PADA GASTROINTESTINAL ATAS,2.308.500
551,50.0,102.5,452.8,786.3,120,K-3-15-0,PROSEDUR ENDOSKOPI KECIL PADA GASTROINTESTINAL ATAS,1.779.800
551,50.0,102.5,452.8,786.3,121,K-3-16-0,PROSEDUR LAIN-LAIN PADA GASTROINTESTINAL,715.600
551,50.0,102.5,452.8,786.3,122,K-5-18-0,PENYAKIT SISTEM PENCERNAAN LAIN-LAIN,393.800
551,50.0,102.5,452.8,786.3,123,L-2-21-0,PROSEDUR BESAR PEMINDAHAN KULIT PADA LUKA BAKAR,2.378.400
551,50.0,102.5,452.8,786.3,124,L-2-22-0,PROSEDUR KECIL PEMINDAHAN KULIT PADA LUKA BAKAR,1.524.600
551,50.0,102.5,452.8,786.3,125,L-2-31-0,PROSEDUR BESAR PEMINDAHAN KULIT TANPA LUKA BAKAR,1.088.600
551,50.0,102.5,452.8,786.3,126,L-2-32-0,PROSEDUR KECIL PEMINDAHAN KULIT TANPA LUKA BAKAR,894.800
551,50.0,102.5,452.8,786.3,127,L-2-41-0,PROSEDUR BEDAH PLASTIK,2.132.200
551,50.0,102.5,452.8,786.3,128,L-2-42-0,PROSEDUR LAIN-LAIN PADA KULIT DAN JARINGAN BAWAH KULIT,657.000
551,50.0,102.5,452.8,786.3,129,L-2-51-0,PROSEDUR PENGANGKATAN PAYUDARA,2.772.200
551,50.0,102.5,452.8,786.3,130,L-2-52-0,PROSEDUR BESAR PADA PAYUDARA TANPA PENGANGKATAN PAYUDARA,2.083.200
551,50.0,102.5,452.8,786.3,131,L-2-53-0,PROSEDUR KECIL PADA PAYUDARA TANPA PENGANGKATAN PAYUDARA,1.068.400
551,50.0,102.5,452.8,786.3,132,L-3-10-0,PROSEDUR KECIL LAIN-LAIN PADA PAYUDARA,738.200
551,50.0,102.5,452.8,786.3,133,L-3-11-0,PROSEDUR BESAR PADA KULIT,604.300
551,50.0,102.5,452.8,786.3,134,L-3-12-0,PROSEDUR KECIL PADA KULIT,469.000
551,50.0,102.5,452.8,786.3,135,M-2-10-0,PROSEDUR REKONTRUKSI TULANG KRANIAL DAN WAJAH,2.269.700
551,50.0,102.5,452.8,786.3,136,M-2-21-0,PROSEDUR BESAR PADA SENDI PANGGUL DAN PAHA,2.494.800
551,50.0,102.5,452.8,786.3,137,M-2-22-0,PROSEDUR KECIL PADA SENDI PANGGUL DAN PAHA,531.900
551,50.0,102.5,452.8,786.3,138,M-2-31-0,PROSEDUR BUNION,1.515.300
551,50.0,102.5,452.8,786.3,139,M-2-32-0,PROSEDUR LAIN-LAIN PADA KAKI,600.200
551,50.0,102.5,452.8,786.3,140,M-2-41-0,"PROSEDUR EKSISI, INSISI DAN ARTHROTOMI TULANG",846.500
551,50.0,102.5,452.8,786.3,141,M-2-42-0,PROSEDUR PEMINDAHAN ALAT IMPLAN,590.700
551,50.0,102.5,452.8,786.3,142,M-2-51-0,PROSEDUR BESAR PADA JARINGAN LUNAK,1.271.900
551,50.0,102.5,452.8,786.3,143,M-2-52-0,PROSEDUR KECIL PADA JARINGAN LUNAK,976.200
551,50.0,102.5,452.8,786.3,144,M-2-61-0,PROSEDUR ARTROSKOPI,1.730.700
551,50.0,102.5,452.8,786.3,145,M-2-62-0,PROSEDUR LAIN-LAIN PADA SENDI & TULANG,594.300
551,50.0,102.5,452.8,786.3,146,M-2-63-0,"PROSEDUR INSISI, BIOPSI DAN GRAFT PADA TULANG",1.567.400
551,50.0,102.5,452.8,786.3,147,M-2-64-0,PROSEDUR BESAR PADA TULANG KEPALA & WAJAH,2.373.100
551,50.0,102.5,452.8,786.3,148,M-2-65-0,PROSEDUR KECIL PADA TULANG KEPALA & WAJAH,506.600
551,50.0,102.5,452.8,786.3,149,M-2-71-0,PROSEDUR BESAR PADA LUTUT & TUNGKAI BAWAH,2.530.600
551,50.0,102.5,452.8,786.3,150,M-2-72-0,PROSEDUR KECIL PADA LUTUT & TUNGKAI BAWAH,1.371.400
551,50.0,102.5,452.8,786.3,151,M-2-81-0,"PROSEDUR BESAR PADA LENGAN, SIKU & BAHU",2.963.500
551,50.0,102.5,452.8,786.3,152,M-2-82-0,"PROSEDUR KECIL PADA LENGAN, SIKU & BAHU",1.496.000
551,50.0,102.5,452.8,786.3,153,M-2-83-0,PROSEDUR BESAR PADA TANGAN & PERGELANGAN TANGAN,1.139.200
551,50.0,102.5,452.8,786.3,154,M-2-84-0,PROSEDUR KECIL PADA TANGAN & PERGELANGAN TANGAN,741.900
551,50.0,102.5,452.8,786.3,155,M-3-10-0,PROSEDUR MANIPULATIVE OSTEOPATHIC,175.600
551,50.0,102.5,452.8,786.3,156,M-3-11-0,PROSEDUR DIAGNOSTIK DAN TERAPEUTIK MUSKULOSKELETAL,658.700
551,50.0,102.5,452.8,786.3,157,M-3-12-0,PROSEDUR BIOPSI SENDI DAN TRAKSI SKELETAL,1.488.400
551,50.0,102.5,452.8,786.3,158,M-3-13-0,PROSEDUR REDUKSI FRAKTUR TERTUTUP,771.700
551,50.0,102.5,452.8,786.3,159,M-3-14-0,PROSEDUR REDUKSI FRAKTUR WAJAH TERTUTUP,783.500
552,50.0,102.5,452.8,786.3,160,M-3-15-0,PROSEDUR APLIKASI CASTS DAN SPLINTS,514.700
552,50.0,102.5,452.8,786.3,161,M-3-16-0,PROSEDUR THERAPI FISIK DAN PROSEDUR KECIL MUSKULOSKLETAL,213.100
552,50.0,102.5,452.8,786.3,162,M-3-17-0,PROSEDUR PEMASANGAN ALAT PROSTETIK,452.500
552,50.0,102.5,452.8,786.3,163,N-2-11-0,PROSEDUR BESAR PADA KANDUNG KEMIH,6.737.900
552,50.0,102.5,452.8,786.3,164,N-2-12-0,"PROSEDUR MEMBUAT BARU, MEREVISI DAN MEMINDAHKAN ALAT DIALISIS",4.752.400
552,50.0,102.5,452.8,786.3,165,N-2-21-0,EXTRACORPOREAL SHOCKWAVE LITHOTRIPSY (ESWL) PADA SALURAN KEMIH,6.584.000
552,50.0,102.5,452.8,786.3,166,N-2-22-0,PROSEDUR BESAR PADA GINJAL DAN URETER,2.520.700
552,50.0,102.5,452.8,786.3,167,N-2-23-0,PROSEDUR SEDANG PADA GINJAL DAN URETER,1.633.300
552,50.0,102.5,452.8,786.3,168,N-2-24-0,PROSEDUR KECIL PADA GINJAL DAN URETER,1.155.200
552,50.0,102.5,452.8,786.3,169,N-2-31-0,PROSEDUR BESAR PADA KANDUNG KEMIH DAN URETHRA,1.447.200
552,50.0,102.5,452.8,786.3,170,N-2-32-0,PROSEDUR KECIL PADA KANDUNG KEMIH DAN URETHRA,864.600
552,50.0,102.5,452.8,786.3,171,N-2-41-0,PROSEDUR BESAR PADA URETHRA DAN TRANSURETHRA,1.709.600
552,50.0,102.5,452.8,786.3,172,N-2-42-0,PROSEDUR KECIL PADA URETHRA DAN TRANSURETHRA,1.015.100
552,50.0,102.5,452.8,786.3,173,N-3-10-0,PROSEDUR PADA GINJAL DAN URETER,556.200
552,50.0,102.5,452.8,786.3,174,N-3-11-0,PROSEDUR DIAGNOSTIK LAIN PADA STUDI SALURAN KEMIH,830.400
552,50.0,102.5,452.8,786.3,175,N-3-12-0,PROSEDUR CYSTOSCOPI & PROSEDUR KECIL ENDOSKOPI SALURAN KEMIH,1.150.300
552,50.0,102.5,452.8,786.3,176,N-3-13-0,PROSEDUR BESAR ENDOSKOPI PADA SALURAN KEMIH,1.320.100
552,50.0,102.5,452.8,786.3,177,N-3-14-0,PROSEDUR KECIL ENDOSKOPI PADA SALURAN KEMIH,554.200
552,50.0,102.5,452.8,786.3,178,N-3-15-0,PROSEDUR DIALISIS,1.051.800
552,50.0,102.5,452.8,786.3,179,O-7-10-0,PROSEDUR PERSALINAN DENGAN BEDAH CAESAR,2.825.100
552,50.0,102.5,452.8,786.3,180,O-7-11-0,PERSALINAN VAGINAL DENGAN STERILISASI DAN ATAU PELEBARAN DAN KURETASE,2.531.600
552,50.0,102.5,452.8,786.3,181,O-7-12-0,PROSEDUR PERSALINAN VAGINAL DENGAN PROSEDUR SELAIN STERILISASI DAN ATAU PELEBARAN DAN KURETASE,2.237.100
552,50.0,102.5,452.8,786.3,182,O-7-13-0,PROSEDUR PERSALINAN MELALUI VAGINAL/JALAN LAHIR,1.697.400
552,50.0,102.5,452.8,786.3,183,P-9-11-0,"NEONATAL, BBL GROUP-2",546.800
552,50.0,102.5,452.8,786.3,184,P-9-12-0,"NEONATAL, BBL GROUP-3",529.900
552,50.0,102.5,452.8,786.3,185,P-9-13-0,"NEONATAL, BBL GROUP-4",480.400
552,50.0,102.5,452.8,786.3,186,P-9-14-0,"NEONATAL, BBL GROUP-5 DENGAN ANOMALI MAYOR ATAU KONDISI HEREDITER",458.300
552,50.0,102.5,452.8,786.3,187,P-9-15-0,"NEONATAL, BBL GROUP-5 DENGAN SINDROM ASPIRASI",394.700
552,50.0,102.5,452.8,786.3,188,P-9-16-0,"NEONATAL, BBL GROUP-5 DENGAN KONGENITAL/INFEKSI PERINATAL",448.600
552,50.0,102.5,452.8,786.3,189,P-9-17-0,"NEONATAL, BBL GROUP-5",478.400
552,50.0,102.5,452.8,786.3,190,Q-5-10-0,PENYALAHGUNAAN ZAT KIMIA AKUT,517.400
552,50.0,102.5,452.8,786.3,191,Q-5-11-0,PENYALAHGUNAAN ZAT KIMIA BUKAN AKUT,381.100
552,50.0,102.5,452.8,786.3,192,Q-5-12-0,GIGI,337.500
552,50.0,102.5,452.8,786.3,193,Q-5-13-0,MEDICAL CHECK-UP,158.300
552,50.0,102.5,452.8,786.3,194,Q-5-14-0,RONGENT (PLAIN FILM),209.200
552,50.0,102.5,452.8,786.3,195,Q-5-15-0,ELEKTROKARDIOGRAM (ECG),106.600
552,50.0,102.5,452.8,786.3,196,Q-5-16-0,VAKSINASI,121.700
552,50.0,102.5,452.8,786.3,197,Q-5-17-0,PASANG INFUS,119.300
552,50.0,102.5,452.8,786.3,198,Q-5-18-0,KONSULTASI ATAU PEMERIKSAAN LAIN-LAIN,391.300
552,50.0,102.5,452.8,786.3,199,Q-5-19-0,KONTAK PELAYANAN KESEHATAN LAIN-LAIN,206.700
552,50.0,102.5,452.8,786.3,200,Q-5-20-0,ABORSI MENGANCAM,267.300
552,50.0,102.5,452.8,786.3,201,Q-5-21-0,ABORSI,293.500
552,50.0,102.5,452.8,786.3,202,Q-5-22-0,PERSALINAN YANG SUKAR (FALSE LABOR),177.200
552,50.0,102.5,452.8,786.3,203,Q-5-23-0,PEMERIKSAAN ANTEPARTUM,189.500
552,50.0,102.5,452.8,786.3,204,Q-5-24-0,PEMERIKSAAN POSTPARTUM,120.600
552,50.0,102.5,452.8,786.3,205,Q-5-25-0,GASTROINTESTINAL AKUT,193.100
552,50.0,102.5,452.8,786.3,206,Q-5-26-0,BRONKIAL AKUT,245.300
552,50.0,102.5,452.8,786.3,207,Q-5-27-0,SISTEM PERSARAFAN PUSAT AKUT,184.200
552,50.0,102.5,452.8,786.3,208,Q-5-28-0,KECEDERAAN SISTEM PERSARAFAN PUSAT,299.900
552,50.0,102.5,452.8,786.3,209,Q-5-29-0,GAGAL JANTUNG KONGESTIF DAN KONDISI JANTUNG LAIN-LAIN,847.600
552,50.0,102.5,452.8,786.3,210,Q-5-30-0,INFARK MIOKARD AKUT DAN ARITMIA,982.700
552,50.0,102.5,452.8,786.3,211,Q-5-31-0,FRAKTUR,233.900
552,50.0,102.5,452.8,786.3,212,Q-5-32-0,SALURAN KEMIH AKUT,407.900
552,50.0,102.5,452.8,786.3,213,Q-5-33-0,HEMATOLOGI AKUT,231.400
552,50.0,102.5,452.8,786.3,214,Q-5-34-0,INFEKSI VIRUS HIV,278.900
552,50.0,102.5,452.8,786.3,215,Q-5-35-0,INFEKSI AKUT,686.200
552,50.0,102.5,452.8,786.3,216,Q-5-36-0,KEKACAUAN METABOLIK AKUT,587.400
552,50.0,102.5,452.8,786.3,217,Q-5-37-0,"CARDIAC ARREST, RESPIRATORY ARREST & SHOCK",474.300
552,50.0,102.5,452.8,786.3,218,Q-5-38-0,PARU AKUT,399.900
552,50.0,102.5,452.8,786.3,219,Q-5-39-0,KECEDERAAN BESAR PADA JARINGAN LUNAK,220.000
552,50.0,102.5,452.8,786.3,220,Q-5-40-0,INFEKSI SALURAN KEMIH AKUT,187.400
552,50.0,102.5,452.8,786.3,221,Q-5-41-0,PENYAKIT AKUT BESAR LAIN-LAIN,470.800
552,50.0,102.5,452.8,786.3,222,Q-5-42-0,PENYAKIT AKUT KECIL LAIN-LAIN,352.900
552,50.0,102.5,452.8,786.3,223,Q-5-43-0,PENYAKIT KRONIS BESAR LAIN-LAIN,506.200
552,50.0,102.5,452.8,786.3,224,Q-5-44-0,PENYAKIT KRONIS KECIL LAIN-LAIN,399.700
552,50.0,102.5,452.8,786.3,225,T-2-10-0,"PEMULIHAN ALKOHOL, OBAT DAN ATAU TERAPI DETOKSIKASI",230.900
552,50.0,102.5,452.8,786.3,226,U-2-10-0,PROSEDUR BESAR PADA LARING,3.701.700
552,50.0,102.5,452.8,786.3,227,U-2-11-0,PROSEDUR BESAR LAIN-LAIN PADA KEPALA & LEHER,3.046.100
552,50.0,102.5,452.8,786.3,228,U-2-12-0,PROSEDUR PADA SINUS & MASTOID,649.200
552,50.0,102.5,452.8,786.3,229,U-2-13-0,PROSEDUR KELENJAR LUDAH,870.400
552,50.0,102.5,452.8,786.3,230,U-2-14-0,PROSEDUR OPERASI BIBIR SUMBING & LANGIT-LANGIT MULUT,1.711.900
552,50.0,102.5,452.8,786.3,231,U-2-15-0,PROSEDUR OPERASI TONSIL & AMANDEL,1.655.500
552,50.0,102.5,452.8,786.3,232,U-2-21-0,"PROSEDUR BESAR PADA TELINGA, HIDUNG, MULUT DAN TENGGOROKAN",1.227.100
552,50.0,102.5,452.8,786.3,233,U-2-22-0,"PROSEDUR SEDANG PADA TELINGA, HIDUNG, MULUT DAN TENGGOROKAN",633.900
552,50.0,102.5,452.8,786.3,234,U-2-23-0,PROSEDUR PERBAIKAN HIDUNG (RHINOPLASTY),1.975.400
552,50.0,102.5,452.8,786.3,235,U-2-24-0,PROSEDUR KECIL PADA HIDUNG,350.400
552,50.0,102.5,452.8,786.3,236,U-2-25-0,PROSEDUR PADA TELINGA TENGAH,515.200
552,50.0,102.5,452.8,786.3,237,U-2-31-0,PROSEDUR BESAR PADA MULUT DAN LIDAH,829.400
552,50.0,102.5,452.8,786.3,238,U-2-32-0,PROSEDUR KECIL PADA MULUT DAN LIDAH,517.500
552,50.0,102.5,452.8,786.3,239,U-3-10-0,"PROSEDUR SEDANG LAIN-LAIN PADA TELINGA, HIDUNG, MULUT DAN TENGGOROKAN",522.700
553,50.0,102.5,452.8,536.6,240,U-3-11-0,"PROSEDUR KECIL LAIN-LAIN PADA TELINGA, HIDUNG, MULUT DAN TENGGOROKAN",494.800
553,50.0,102.5,452.8,536.6,241,U-3-12-0,PROSEDUR KAUTERISASI & PACKING PADA RONGGA HIDUNG,292.600
553,50.0,102.5,452.8,536.6,242,U-3-13-0,"PROSEDUR DIAGNOSTIK LAIN-LAIN PADA TELINGA, HIDUNG, MULUT DAN TENGGOROKAN",509.200
553,50.0,102.5,452.8,536.6,243,U-3-14-0,"PROSEDUR TES FUNGSI PADA TELINGA, HIDUNG, MULUT DAN TENGGOROKAN",460.900
553,50.0,102.5,452.8,536.6,244,U-3-15-0,"PROSEDUR LAIN-LAIN PADA TELINGA, HIDUNG, MULUT DAN TENGGOROKAN",408.300
553,50.0,102.5,452.8,536.6,245,U-3-16-0,PROSEDUR PADA GIGI,473.300
553,50.0,102.5,452.8,536.6,246,V-2-10-0,PROSEDUR BESAR PADA PENGANGKATAN PROSTAT,3.822.000
553,50.0,102.5,452.8,536.6,247,V-2-11-0,PROSEDUR PADA PENIS,663.300
553,50.0,102.5,452.8,536.6,248,V-2-12-0,PROSEDUR SEDANG PADA PROSTAT DAN SKROTUM,1.375.500
553,50.0,102.5,452.8,536.6,249,V-2-13-0,PROSEDUR KECIL PADA PROSTAT DAN SKROTUM,500.300
553,50.0,102.5,452.8,536.6,250,V-2-14-0,PENGANGKATAN PROSTAT MELALUI TRANSURETHRAL,884.800
553,50.0,102.5,452.8,536.6,251,V-2-15-0,SIRKUMSISI/SUNAT,576.200
553,50.0,102.5,452.8,536.6,252,V-3-10-0,PROSEDUR STERILISASI PADA LAKI-LAKI,506.900
553,50.0,102.5,452.8,536.6,253,V-3-11-0,PROSEDUR DIAGNOSTIK DAN TERAPEUTIK PADA ALAT GENITAL LAKI-LAKI,1.235.500
553,50.0,102.5,452.8,536.6,254,V-3-12-0,PROSEDUR LAIN PADA ALAT GENITAL LAKI-LAKI,1.223.300
553,50.0,102.5,452.8,536.6,255,W-2-10-0,PROSEDUR ABORSI,1.678.800
553,50.0,102.5,452.8,536.6,256,W-2-11-0,"PROSEDUR PELEBARAN, KURETASE DALAM RAHIM & LEHER RAHIM",1.497.700
553,50.0,102.5,452.8,536.6,257,W-2-12-0,PROSEDUR MEMBUKA TUBA YANG TERHALANG/TERGANGGU,1.682.000
553,50.0,102.5,452.8,536.6,258,W-2-13-0,PROSEDUR ENDOSKOPI TUBA YANG TERHALANG/TERGANGGU,1.208.300
553,50.0,102.5,452.8,536.6,259,W-2-21-0,PROSEDUR BESAR PADA FRAKTUR RONGGA PANGGUL TERBUKA,2.949.800
553,50.0,102.5,452.8,536.6,260,W-2-22-0,PROSEDUR KECIL PADA FRAKTUR RONGGA PANGGUL TERBUKA,712.200
553,50.0,102.5,452.8,536.6,261,W-2-23-0,PROSEDUR LAPAROSKOPI GINEKOLOGI,1.591.100
553,50.0,102.5,452.8,536.6,262,W-2-31-0,PROSEDUR PEMBUANGAN RAHIM MELALUI JALAN LAHIR,3.398.200
553,50.0,102.5,452.8,536.6,263,W-2-32-0,PROSEDUR PERBAIKAN CYSTOCELE DAN VULVOVAGINAL INTERMEDIATE,3.143.400
553,50.0,102.5,452.8,536.6,264,W-2-33-0,PROSEDUR KECIL VULVOVAGINAL,1.384.800
553,50.0,102.5,452.8,536.6,265,W-2-34-0,PROSEDUR GINEKOLOGI LAIN-LAIN,584.800
553,50.0,102.5,452.8,536.6,266,W-3-10-0,PROSEDUR KECIL GINEKOLOGI & ENDOSKOPI,1.168.200
553,50.0,102.5,452.8,536.6,267,W-3-11-0,PROSEDUR SEDANG GINEKOLOGI,966.800
553,50.0,102.5,452.8,536.6,268,W-3-12-0,PROSEDUR KECIL GINEKOLOGI,448.100
553,50.0,102.5,452.8,536.6,269,Z-3-10-0,PROSEDUR RADIOSURGICAL,3.512.000
553,50.0,102.5,452.8,536.6,270,Z-3-11-0,EXTRACORPOREAL SHOCKWAVE LITHOTRIPSY (ESWL) SELAIN URINARI DAN SALURAN EMPEDU,3.397.700
553,50.0,102.5,452.8,536.6,271,Z-3-12-0,PROSEDUR REHABILITASI,255.700
553,50.0,102.5,452.8,536.6,272,Z-3-13-0,PROSEDUR KECIL PELAYANAN PENUNJANG LAIN-LAIN,219.600
553,50.0,102.5,452.8,536.6,273,Z-3-14-0,DIAGNOSTIK TIDUR,531.500
553,50.0,102.5,452.8,536.6,274,Z-3-15-0,IMAGING NUKLIR JANTUNG,652.600
553,50.0,102.5,452.8,536.6,275,Z-3-16-0,PROSEDUR MAGNETIC RESONANCE IMAGING (MRI),1.522.900
553,50.0,102.5,452.8,536.6,276,Z-3-17-0,PENGOBATAN NUKLIR,1.745.000
553,50.0,102.5,452.8,536.6,277,Z-3-18-0,CT-SCAN KEPALA,1.489.500
553,50.0,102.5,452.8,536.6,278,Z-3-19-0,CT SCAN LAIN-LAIN,1.805.600
553,50.0,102.5,452.8,536.6,279,Z-3-20-0,IMAGING KONTRAS SALURAN URINARI,903.200
553,50.0,102.5,452.8,536.6,280,Z-3-21-0,IMAGING KONTRAS PEMBULUH DARAH,1.340.400
553,50.0,102.5,452.8,536.6,281,Z-3-22-0,IMAGING KONTRAS LAIN-LAIN,868.300
553,50.0,102.5,452.8,536.6,282,Z-3-23-0,PROSEDUR ULTRASOUND LAIN-LAIN,695.000
553,50.0,102.5,452.8,536.6,283,Z-3-24-0,PROSEDUR ULTRASOUND PEMBULUH DARAH,838.000
553,50.0,102.5,452.8,536.6,284,Z-3-25-0,PROSEDUR ULTRASOUND GINEKOLOGIK,482.200
553,50.0,102.5,452.8,536.6,285,Z-3-26-0,PROSEDUR BESAR RADIOGRAFI,1.140.000
553,50.0,102.5,452.8,536.6,286,Z-3-27-0,PERAWATAN LUKA,235.500
553,50.0,102.5,452.8,536.6,287,Z-3-28-0,IMAGING PAYUDARA,902.200
553,50.0,102.5,452.8,536.6,288,Z-3-29-0,IMAGING LAIN-LAIN,1.919.500
553,50.0,102.5,452.8,536.6,289,Z-3-30-0,FOTOTERAPI,130.100
